"No.","Time","Source","Destination","Protocol","Length","Info"
"22","6.108294","192.168.0.107","10.0.25.10","DNS","76","Standard query 0x9311 A us04www3.zoom.us"
"23","6.125545","10.0.25.10","192.168.0.107","DNS","92","Standard query response 0x9311 A us04www3.zoom.us A 3.235.69.5"
"24","6.132830","192.168.0.107","us04www3.zoom.us","TCP","78","50237  >  443 [SYN, ECN, CWR] Seq=0 Win=65535 Len=0 MSS=1460 WS=64 TSval=532758480 TSecr=0 SACK_PERM=1"
"25","6.148992","us04www3.zoom.us","192.168.0.107","TCP","74","443  >  50237 [SYN, ACK, ECN] Seq=0 Ack=1 Win=65236 Len=0 MSS=1360 SACK_PERM=1 TSval=1943028946 TSecr=532758480 WS=128"
"26","6.149106","192.168.0.107","us04www3.zoom.us","TCP","66","50237  >  443 [ACK] Seq=1 Ack=1 Win=132096 Len=0 TSval=532758496 TSecr=1943028946"
"28","6.163788","192.168.0.107","us04www3.zoom.us","TLSv1.2","583","Client Hello"
"30","6.231647","us04www3.zoom.us","192.168.0.107","TCP","66","443  >  50237 [ACK] Seq=1 Ack=518 Win=64512 Len=0 TSval=1943029030 TSecr=532758510"
"33","6.485324","us04www3.zoom.us","192.168.0.107","TLSv1.2","1354","Server Hello"
"34","6.485329","us04www3.zoom.us","192.168.0.107","TCP","1354","443  >  50237 [ACK] Seq=1289 Ack=518 Win=64512 Len=1288 TSval=1943029282 TSecr=532758510 [TCP segment of a reassembled PDU]"
"35","6.485516","192.168.0.107","us04www3.zoom.us","TCP","66","50237  >  443 [ACK] Seq=518 Ack=2577 Win=129472 Len=0 TSval=532758828 TSecr=1943029282"
"36","6.486723","us04www3.zoom.us","192.168.0.107","TCP","1354","443  >  50237 [ACK] Seq=2577 Ack=518 Win=64512 Len=1288 TSval=1943029282 TSecr=532758510 [TCP segment of a reassembled PDU]"
"37","6.487481","us04www3.zoom.us","192.168.0.107","TLSv1.2","510","Certificate, Server Key Exchange, Server Hello Done"
"38","6.487584","192.168.0.107","us04www3.zoom.us","TCP","66","50237  >  443 [ACK] Seq=518 Ack=4309 Win=127744 Len=0 TSval=532758829 TSecr=1943029282"
"39","6.498080","192.168.0.107","us04www3.zoom.us","TCP","66","[TCP Window Update] 50237  >  443 [ACK] Seq=518 Ack=4309 Win=130688 Len=0 TSval=532758840 TSecr=1943029282"
"40","6.499442","192.168.0.107","us04www3.zoom.us","TLSv1.2","192","Client Key Exchange, Change Cipher Spec, Encrypted Handshake Message"
"41","6.515728","us04www3.zoom.us","192.168.0.107","TCP","66","443  >  50237 [ACK] Seq=4309 Ack=644 Win=64512 Len=0 TSval=1943029322 TSecr=532758841"
"44","6.677771","us04www3.zoom.us","192.168.0.107","TLSv1.2","117","Change Cipher Spec, Encrypted Handshake Message"
"45","6.677866","192.168.0.107","us04www3.zoom.us","TCP","66","50237  >  443 [ACK] Seq=644 Ack=4360 Win=131008 Len=0 TSval=532759018 TSecr=1943029470"
"46","6.685757","192.168.0.107","us04www3.zoom.us","TCP","1414","50237  >  443 [ACK] Seq=644 Ack=4360 Win=131072 Len=1348 TSval=532759025 TSecr=1943029470 [TCP segment of a reassembled PDU]"
"47","6.685759","192.168.0.107","us04www3.zoom.us","TLSv1.2","868","Application Data"
"48","6.708319","us04www3.zoom.us","192.168.0.107","TCP","66","443  >  50237 [ACK] Seq=4360 Ack=2794 Win=63360 Len=0 TSval=1943029508 TSecr=532759025"
"56","6.964444","us04www3.zoom.us","192.168.0.107","TCP","1354","443  >  50237 [ACK] Seq=4360 Ack=2794 Win=64256 Len=1288 TSval=1943029764 TSecr=532759025 [TCP segment of a reassembled PDU]"
"57","6.964450","us04www3.zoom.us","192.168.0.107","TCP","1354","443  >  50237 [ACK] Seq=5648 Ack=2794 Win=64256 Len=1288 TSval=1943029764 TSecr=532759025 [TCP segment of a reassembled PDU]"
"58","6.964589","192.168.0.107","us04www3.zoom.us","TCP","66","50237  >  443 [ACK] Seq=2794 Ack=6936 Win=128448 Len=0 TSval=532759302 TSecr=1943029764"
"59","6.966507","us04www3.zoom.us","192.168.0.107","TCP","1354","443  >  50237 [ACK] Seq=6936 Ack=2794 Win=64256 Len=1288 TSval=1943029764 TSecr=532759025 [TCP segment of a reassembled PDU]"
"60","6.968075","us04www3.zoom.us","192.168.0.107","TLSv1.2","1354","Application Data [TCP segment of a reassembled PDU]"
"61","6.968085","us04www3.zoom.us","192.168.0.107","TLSv1.2","1142","Application Data"
"62","6.968209","192.168.0.107","us04www3.zoom.us","TCP","66","50237  >  443 [ACK] Seq=2794 Ack=9512 Win=125888 Len=0 TSval=532759305 TSecr=1943029764"
"63","6.968210","192.168.0.107","us04www3.zoom.us","TCP","66","50237  >  443 [ACK] Seq=2794 Ack=10588 Win=124800 Len=0 TSval=532759305 TSecr=1943029764"
"64","6.973638","192.168.0.107","us04www3.zoom.us","TCP","66","[TCP Window Update] 50237  >  443 [ACK] Seq=2794 Ack=10588 Win=128960 Len=0 TSval=532759310 TSecr=1943029764"
"68","7.100883","192.168.0.107","10.0.25.10","DNS","94","Standard query 0x3361 A zoomca129-151-7-84zc.cloud.zoom.us"
"69","7.101072","192.168.0.107","10.0.25.10","DNS","95","Standard query 0x0fa4 A zoomca129-151-8-130zc.cloud.zoom.us"
"70","7.102211","192.168.0.107","10.0.25.10","DNS","96","Standard query 0x73fd A zoomva193-123-130-78zc.cloud.zoom.us"
"71","7.103313","192.168.0.107","10.0.25.10","DNS","96","Standard query 0x3b45 A zoomva193-123-140-54zc.cloud.zoom.us"
"72","7.118689","10.0.25.10","192.168.0.107","DNS","112","Standard query response 0x73fd A zoomva193-123-130-78zc.cloud.zoom.us A 193.123.130.78"
"73","7.118695","10.0.25.10","192.168.0.107","DNS","111","Standard query response 0x0fa4 A zoomca129-151-8-130zc.cloud.zoom.us A 129.151.8.130"
"74","7.118827","10.0.25.10","192.168.0.107","DNS","110","Standard query response 0x3361 A zoomca129-151-7-84zc.cloud.zoom.us A 129.151.7.84"
"75","7.120243","192.168.0.107","zoomca129-151-8-130zc.cloud.zoom.us","TCP","78","50238  >  443 [SYN, ECN, CWR] Seq=0 Win=65535 Len=0 MSS=1460 WS=64 TSval=532759454 TSecr=0 SACK_PERM=1"
"76","7.131820","192.168.0.107","zoomva193-123-130-78zc.cloud.zoom.us","TCP","78","50239  >  443 [SYN, ECN, CWR] Seq=0 Win=65535 Len=0 MSS=1460 WS=64 TSval=532759465 TSecr=0 SACK_PERM=1"
"77","7.132018","192.168.0.107","zoomca129-151-7-84zc.cloud.zoom.us","TCP","78","50240  >  443 [SYN, ECN, CWR] Seq=0 Win=65535 Len=0 MSS=1460 WS=64 TSval=532759465 TSecr=0 SACK_PERM=1"
"78","7.140531","zoomca129-151-8-130zc.cloud.zoom.us","192.168.0.107","TCP","74","443  >  50238 [SYN, ACK, ECN] Seq=0 Ack=1 Win=65236 Len=0 MSS=1360 SACK_PERM=1 TSval=1622468883 TSecr=532759454 WS=128"
"79","7.140652","192.168.0.107","zoomca129-151-8-130zc.cloud.zoom.us","TCP","66","50238  >  443 [ACK] Seq=1 Ack=1 Win=132096 Len=0 TSval=532759473 TSecr=1622468883"
"80","7.141075","192.168.0.107","zoomca129-151-8-130zc.cloud.zoom.us","TLSv1.2","583","Client Hello"
"81","7.147700","zoomca129-151-7-84zc.cloud.zoom.us","192.168.0.107","TCP","74","443  >  50240 [SYN, ACK, ECN] Seq=0 Ack=1 Win=65236 Len=0 MSS=1360 SACK_PERM=1 TSval=1776406801 TSecr=532759465 WS=128"
"82","7.147706","zoomva193-123-130-78zc.cloud.zoom.us","192.168.0.107","TCP","74","443  >  50239 [SYN, ACK, ECN] Seq=0 Ack=1 Win=65236 Len=0 MSS=1360 SACK_PERM=1 TSval=3372082748 TSecr=532759465 WS=128"
"83","7.147836","192.168.0.107","zoomca129-151-7-84zc.cloud.zoom.us","TCP","66","50240  >  443 [ACK] Seq=1 Ack=1 Win=132096 Len=0 TSval=532759479 TSecr=1776406801"
"84","7.147837","192.168.0.107","zoomva193-123-130-78zc.cloud.zoom.us","TCP","66","50239  >  443 [ACK] Seq=1 Ack=1 Win=132096 Len=0 TSval=532759479 TSecr=3372082748"
"85","7.148237","192.168.0.107","zoomva193-123-130-78zc.cloud.zoom.us","TLSv1.2","583","Client Hello"
"86","7.148678","192.168.0.107","zoomca129-151-7-84zc.cloud.zoom.us","TLSv1.2","583","Client Hello"
"87","7.190020","10.0.25.10","192.168.0.107","DNS","112","Standard query response 0x3b45 A zoomva193-123-140-54zc.cloud.zoom.us A 193.123.140.54"
"88","7.191019","192.168.0.107","zoomva193-123-140-54zc.cloud.zoom.us","TCP","78","50241  >  443 [SYN, ECN, CWR] Seq=0 Win=65535 Len=0 MSS=1460 WS=64 TSval=532759521 TSecr=0 SACK_PERM=1"
"89","7.203190","zoomva193-123-140-54zc.cloud.zoom.us","192.168.0.107","TCP","74","443  >  50241 [SYN, ACK, ECN] Seq=0 Ack=1 Win=65236 Len=0 MSS=1360 SACK_PERM=1 TSval=1638945184 TSecr=532759521 WS=128"
"90","7.203311","192.168.0.107","zoomva193-123-140-54zc.cloud.zoom.us","TCP","66","50241  >  443 [ACK] Seq=1 Ack=1 Win=132096 Len=0 TSval=532759533 TSecr=1638945184"
"91","7.203744","192.168.0.107","zoomva193-123-140-54zc.cloud.zoom.us","TLSv1.2","583","Client Hello"
"92","7.212598","192.168.0.107","zoomca129-151-7-84zc.cloud.zoom.us","TCP","583","[TCP Retransmission] 50240  >  443 [PSH, ACK] Seq=1 Ack=1 Win=132096 Len=517 TSval=532759542 TSecr=1776406801"
"93","7.212599","192.168.0.107","zoomva193-123-130-78zc.cloud.zoom.us","TCP","583","[TCP Retransmission] 50239  >  443 [PSH, ACK] Seq=1 Ack=1 Win=132096 Len=517 TSval=532759542 TSecr=3372082748"
"94","7.221492","zoomca129-151-8-130zc.cloud.zoom.us","192.168.0.107","TCP","66","443  >  50238 [ACK] Seq=1 Ack=518 Win=64512 Len=0 TSval=1622468997 TSecr=532759473"
"95","7.233523","zoomva193-123-130-78zc.cloud.zoom.us","192.168.0.107","TCP","66","443  >  50239 [ACK] Seq=1 Ack=518 Win=64512 Len=0 TSval=3372082874 TSecr=532759479"
"96","7.233528","zoomca129-151-7-84zc.cloud.zoom.us","192.168.0.107","TCP","66","443  >  50240 [ACK] Seq=1 Ack=518 Win=64512 Len=0 TSval=1776406927 TSecr=532759479"
"97","7.235467","zoomca129-151-7-84zc.cloud.zoom.us","192.168.0.107","TCP","78","[TCP Dup ACK 96#1] 443  >  50240 [ACK] Seq=1 Ack=518 Win=64512 Len=0 TSval=1776406930 TSecr=532759542 SLE=1 SRE=518"
"98","7.235473","zoomva193-123-130-78zc.cloud.zoom.us","192.168.0.107","TCP","78","[TCP Dup ACK 95#1] 443  >  50239 [ACK] Seq=1 Ack=518 Win=64512 Len=0 TSval=3372082877 TSecr=532759542 SLE=1 SRE=518"
"99","7.260259","192.168.0.107","zoomva193-123-140-54zc.cloud.zoom.us","TCP","583","[TCP Retransmission] 50241  >  443 [PSH, ACK] Seq=1 Ack=1 Win=132096 Len=517 TSval=532759587 TSecr=1638945184"
"100","7.265438","zoomva193-123-140-54zc.cloud.zoom.us","192.168.0.107","TCP","66","443  >  50241 [ACK] Seq=1 Ack=518 Win=64512 Len=0 TSval=1638945277 TSecr=532759533"
"101","7.277855","zoomva193-123-140-54zc.cloud.zoom.us","192.168.0.107","TCP","78","[TCP Dup ACK 100#1] 443  >  50241 [ACK] Seq=1 Ack=518 Win=64512 Len=0 TSval=1638945296 TSecr=532759587 SLE=1 SRE=518"
"102","7.517799","zoomva193-123-130-78zc.cloud.zoom.us","192.168.0.107","TLSv1.2","1354","Server Hello"
"103","7.519343","zoomva193-123-130-78zc.cloud.zoom.us","192.168.0.107","TCP","1354","443  >  50239 [ACK] Seq=1289 Ack=518 Win=64512 Len=1288 TSval=3372083127 TSecr=532759542 [TCP segment of a reassembled PDU]"
"104","7.519444","192.168.0.107","zoomva193-123-130-78zc.cloud.zoom.us","TCP","66","50239  >  443 [ACK] Seq=518 Ack=2577 Win=129728 Len=0 TSval=532759844 TSecr=3372083127"
"105","7.519699","zoomva193-123-130-78zc.cloud.zoom.us","192.168.0.107","TCP","1354","443  >  50239 [ACK] Seq=2577 Ack=518 Win=64512 Len=1288 TSval=3372083127 TSecr=532759542 [TCP segment of a reassembled PDU]"
"106","7.521763","zoomva193-123-130-78zc.cloud.zoom.us","192.168.0.107","TLSv1.2","501","Certificate, Server Key Exchange, Server Hello Done"
"107","7.521890","192.168.0.107","zoomva193-123-130-78zc.cloud.zoom.us","TCP","66","50239  >  443 [ACK] Seq=518 Ack=4300 Win=130624 Len=0 TSval=532759846 TSecr=3372083127"
"108","7.523498","zoomva193-123-140-54zc.cloud.zoom.us","192.168.0.107","TLSv1.2","1354","Server Hello"
"109","7.523822","zoomva193-123-140-54zc.cloud.zoom.us","192.168.0.107","TCP","1354","443  >  50241 [ACK] Seq=1289 Ack=518 Win=64512 Len=1288 TSval=1638945528 TSecr=532759587 [TCP segment of a reassembled PDU]"
"110","7.523906","192.168.0.107","zoomva193-123-140-54zc.cloud.zoom.us","TCP","66","50241  >  443 [ACK] Seq=518 Ack=2577 Win=129472 Len=0 TSval=532759847 TSecr=1638945528"
"111","7.524214","zoomva193-123-140-54zc.cloud.zoom.us","192.168.0.107","TCP","1354","443  >  50241 [ACK] Seq=2577 Ack=518 Win=64512 Len=1288 TSval=1638945528 TSecr=532759587 [TCP segment of a reassembled PDU]"
"112","7.524219","zoomva193-123-140-54zc.cloud.zoom.us","192.168.0.107","TLSv1.2","298","Certificate [TCP segment of a reassembled PDU]"
"113","7.524360","192.168.0.107","zoomva193-123-140-54zc.cloud.zoom.us","TCP","66","50241  >  443 [ACK] Seq=518 Ack=4097 Win=128000 Len=0 TSval=532759847 TSecr=1638945528"
"114","7.524687","zoomva193-123-140-54zc.cloud.zoom.us","192.168.0.107","TLSv1.2","269","Server Key Exchange, Server Hello Done"
"115","7.524814","192.168.0.107","zoomva193-123-140-54zc.cloud.zoom.us","TCP","66","50241  >  443 [ACK] Seq=518 Ack=4300 Win=127744 Len=0 TSval=532759848 TSecr=1638945528"
"116","7.535004","192.168.0.107","zoomva193-123-130-78zc.cloud.zoom.us","TLSv1.2","192","Client Key Exchange, Change Cipher Spec, Encrypted Handshake Message"
"117","7.535068","192.168.0.107","zoomva193-123-140-54zc.cloud.zoom.us","TCP","66","[TCP Window Update] 50241  >  443 [ACK] Seq=518 Ack=4300 Win=130688 Len=0 TSval=532759857 TSecr=1638945528"
"118","7.541643","192.168.0.107","zoomva193-123-140-54zc.cloud.zoom.us","TLSv1.2","192","Client Key Exchange, Change Cipher Spec, Encrypted Handshake Message"
"119","7.558620","zoomva193-123-130-78zc.cloud.zoom.us","192.168.0.107","TCP","66","443  >  50239 [ACK] Seq=4300 Ack=644 Win=64512 Len=0 TSval=3372083197 TSecr=532759857"
"120","7.566700","zoomva193-123-140-54zc.cloud.zoom.us","192.168.0.107","TCP","66","443  >  50241 [ACK] Seq=4300 Ack=644 Win=64512 Len=0 TSval=1638945579 TSecr=532759863"
"121","7.584584","zoomca129-151-8-130zc.cloud.zoom.us","192.168.0.107","TLSv1.2","1354","Server Hello"
"122","7.584590","zoomca129-151-8-130zc.cloud.zoom.us","192.168.0.107","TCP","1354","443  >  50238 [ACK] Seq=1289 Ack=518 Win=64512 Len=1288 TSval=1622469363 TSecr=532759473 [TCP segment of a reassembled PDU]"
"123","7.584744","192.168.0.107","zoomca129-151-8-130zc.cloud.zoom.us","TCP","66","50238  >  443 [ACK] Seq=518 Ack=2577 Win=129472 Len=0 TSval=532759905 TSecr=1622469363"
"124","7.585176","zoomca129-151-8-130zc.cloud.zoom.us","192.168.0.107","TCP","1354","443  >  50238 [ACK] Seq=2577 Ack=518 Win=64512 Len=1288 TSval=1622469363 TSecr=532759473 [TCP segment of a reassembled PDU]"
"125","7.585462","zoomca129-151-8-130zc.cloud.zoom.us","192.168.0.107","TLSv1.2","501","Certificate, Server Key Exchange, Server Hello Done"
"126","7.585486","192.168.0.107","zoomca129-151-8-130zc.cloud.zoom.us","TCP","66","50238  >  443 [ACK] Seq=518 Ack=3865 Win=131072 Len=0 TSval=532759905 TSecr=1622469363"
"127","7.585537","192.168.0.107","zoomca129-151-8-130zc.cloud.zoom.us","TCP","66","50238  >  443 [ACK] Seq=518 Ack=4300 Win=130624 Len=0 TSval=532759905 TSecr=1622469363"
"128","7.596553","192.168.0.107","zoomca129-151-8-130zc.cloud.zoom.us","TLSv1.2","192","Client Key Exchange, Change Cipher Spec, Encrypted Handshake Message"
"129","7.600284","zoomca129-151-7-84zc.cloud.zoom.us","192.168.0.107","TLSv1.2","1354","Server Hello"
"130","7.602640","zoomca129-151-7-84zc.cloud.zoom.us","192.168.0.107","TCP","1354","443  >  50240 [ACK] Seq=1289 Ack=518 Win=64512 Len=1288 TSval=1776407291 TSecr=532759542 [TCP segment of a reassembled PDU]"
"131","7.602816","zoomca129-151-7-84zc.cloud.zoom.us","192.168.0.107","TCP","1354","443  >  50240 [ACK] Seq=2577 Ack=518 Win=64512 Len=1288 TSval=1776407291 TSecr=532759542 [TCP segment of a reassembled PDU]"
"132","7.602849","192.168.0.107","zoomca129-151-7-84zc.cloud.zoom.us","TCP","66","50240  >  443 [ACK] Seq=518 Ack=2577 Win=129728 Len=0 TSval=532759921 TSecr=1776407291"
"133","7.603491","zoomca129-151-7-84zc.cloud.zoom.us","192.168.0.107","TLSv1.2","501","Certificate, Server Key Exchange, Server Hello Done"
"134","7.603607","192.168.0.107","zoomca129-151-7-84zc.cloud.zoom.us","TCP","66","50240  >  443 [ACK] Seq=518 Ack=4300 Win=130624 Len=0 TSval=532759921 TSecr=1776407291"
"135","7.614073","192.168.0.107","zoomca129-151-7-84zc.cloud.zoom.us","TLSv1.2","192","Client Key Exchange, Change Cipher Spec, Encrypted Handshake Message"
"136","7.619885","zoomca129-151-8-130zc.cloud.zoom.us","192.168.0.107","TCP","66","443  >  50238 [ACK] Seq=4300 Ack=644 Win=64512 Len=0 TSval=1622469399 TSecr=532759916"
"138","7.635811","zoomca129-151-7-84zc.cloud.zoom.us","192.168.0.107","TCP","66","443  >  50240 [ACK] Seq=4300 Ack=644 Win=64512 Len=0 TSval=1776407330 TSecr=532759931"
"140","7.699766","zoomva193-123-130-78zc.cloud.zoom.us","192.168.0.107","TLSv1.2","117","Change Cipher Spec, Encrypted Handshake Message"
"141","7.699880","192.168.0.107","zoomva193-123-130-78zc.cloud.zoom.us","TCP","66","50239  >  443 [ACK] Seq=644 Ack=4351 Win=131008 Len=0 TSval=532760015 TSecr=3372083346"
"142","7.700285","192.168.0.107","zoomva193-123-130-78zc.cloud.zoom.us","TLSv1.2","220","Application Data"
"143","7.730455","zoomva193-123-130-78zc.cloud.zoom.us","192.168.0.107","TCP","66","443  >  50239 [ACK] Seq=4351 Ack=798 Win=64384 Len=0 TSval=3372083377 TSecr=532760015"
"144","7.831852","zoomca129-151-8-130zc.cloud.zoom.us","192.168.0.107","TLSv1.2","117","Change Cipher Spec, Encrypted Handshake Message"
"145","7.831952","192.168.0.107","zoomca129-151-8-130zc.cloud.zoom.us","TCP","66","50238  >  443 [ACK] Seq=644 Ack=4351 Win=131008 Len=0 TSval=532760146 TSecr=1622469604"
"146","7.832286","192.168.0.107","zoomca129-151-8-130zc.cloud.zoom.us","TLSv1.2","220","Application Data"
"147","7.835842","zoomca129-151-7-84zc.cloud.zoom.us","192.168.0.107","TLSv1.2","117","Change Cipher Spec, Encrypted Handshake Message"
"148","7.835923","192.168.0.107","zoomca129-151-7-84zc.cloud.zoom.us","TCP","66","50240  >  443 [ACK] Seq=644 Ack=4351 Win=131008 Len=0 TSval=532760149 TSecr=1776407531"
"149","7.836303","192.168.0.107","zoomca129-151-7-84zc.cloud.zoom.us","TLSv1.2","220","Application Data"
"150","7.844213","zoomca129-151-8-130zc.cloud.zoom.us","192.168.0.107","TCP","66","443  >  50238 [ACK] Seq=4351 Ack=798 Win=64384 Len=0 TSval=1622469627 TSecr=532760146"
"151","7.873247","zoomca129-151-7-84zc.cloud.zoom.us","192.168.0.107","TCP","66","443  >  50240 [ACK] Seq=4351 Ack=798 Win=64384 Len=0 TSval=1776407570 TSecr=532760149"
"152","7.884522","zoomva193-123-130-78zc.cloud.zoom.us","192.168.0.107","TLSv1.2","140","Application Data"
"153","7.884643","192.168.0.107","zoomva193-123-130-78zc.cloud.zoom.us","TCP","66","50239  >  443 [ACK] Seq=798 Ack=4425 Win=130944 Len=0 TSval=532760196 TSecr=3372083526"
"154","7.890134","192.168.0.107","zoomva193-123-130-78zc.cloud.zoom.us","TLSv1.2","730","Application Data"
"155","7.926176","zoomva193-123-130-78zc.cloud.zoom.us","192.168.0.107","TCP","66","443  >  50239 [ACK] Seq=4425 Ack=1462 Win=64256 Len=0 TSval=3372083565 TSecr=532760201"
"156","8.048839","zoomca129-151-8-130zc.cloud.zoom.us","192.168.0.107","TLSv1.2","140","Application Data"
"157","8.048954","192.168.0.107","zoomca129-151-8-130zc.cloud.zoom.us","TCP","66","50238  >  443 [ACK] Seq=798 Ack=4425 Win=130944 Len=0 TSval=532760358 TSecr=1622469829"
"158","8.053994","192.168.0.107","zoomca129-151-8-130zc.cloud.zoom.us","TLSv1.2","729","Application Data"
"159","8.063160","zoomva193-123-130-78zc.cloud.zoom.us","192.168.0.107","TLSv1.2","523","Application Data"
"160","8.063278","192.168.0.107","zoomva193-123-130-78zc.cloud.zoom.us","TCP","66","50239  >  443 [ACK] Seq=1462 Ack=4882 Win=130560 Len=0 TSval=532760372 TSecr=3372083706"
"161","8.064451","192.168.0.107","zoomca129-151-7-84zc.cloud.zoom.us","TLSv1.2","97","Encrypted Alert"
"162","8.064631","zoomca129-151-8-130zc.cloud.zoom.us","192.168.0.107","TCP","66","443  >  50238 [ACK] Seq=4425 Ack=1461 Win=64256 Len=0 TSval=1622469848 TSecr=532760363"
"163","8.064760","192.168.0.107","zoomca129-151-7-84zc.cloud.zoom.us","TCP","66","50240  >  443 [FIN, ACK] Seq=829 Ack=4351 Win=131072 Len=0 TSval=532760373 TSecr=1776407570"
"164","8.064826","192.168.0.107","zoomca129-151-8-130zc.cloud.zoom.us","TLSv1.2","107","Application Data"
"165","8.064845","192.168.0.107","zoomca129-151-8-130zc.cloud.zoom.us","TLSv1.2","97","Encrypted Alert"
"166","8.065133","192.168.0.107","zoomca129-151-8-130zc.cloud.zoom.us","TCP","66","50238  >  443 [FIN, ACK] Seq=1533 Ack=4425 Win=131072 Len=0 TSval=532760373 TSecr=1622469848"
"167","8.065277","192.168.0.107","zoomva193-123-130-78zc.cloud.zoom.us","TLSv1.2","107","Application Data"
"168","8.065331","192.168.0.107","zoomva193-123-130-78zc.cloud.zoom.us","TLSv1.2","97","Encrypted Alert"
"169","8.065467","192.168.0.107","zoomva193-123-130-78zc.cloud.zoom.us","TCP","66","50239  >  443 [FIN, ACK] Seq=1534 Ack=4882 Win=131072 Len=0 TSval=532760374 TSecr=3372083706"
"170","8.065641","192.168.0.107","zoomva193-123-140-54zc.cloud.zoom.us","TCP","66","50241  >  443 [FIN, ACK] Seq=644 Ack=4300 Win=131072 Len=0 TSval=532760374 TSecr=1638945579"
"171","8.066666","192.168.0.107","10.0.25.10","DNS","98","Standard query 0x9e1c A zoomva193-123-143-170mmr.cloud.zoom.us"
"172","8.080956","zoomca129-151-7-84zc.cloud.zoom.us","192.168.0.107","TLSv1.2","140","Application Data"
"173","8.081089","192.168.0.107","zoomca129-151-7-84zc.cloud.zoom.us","TCP","54","50240  >  443 [RST] Seq=798 Win=0 Len=0"
"174","8.117812","zoomva193-123-130-78zc.cloud.zoom.us","192.168.0.107","TCP","66","443  >  50239 [ACK] Seq=4882 Ack=1503 Win=64256 Len=0 TSval=3372083753 TSecr=532760373"
"175","8.117819","zoomva193-123-130-78zc.cloud.zoom.us","192.168.0.107","TCP","66","443  >  50239 [ACK] Seq=4882 Ack=1534 Win=64256 Len=0 TSval=3372083753 TSecr=532760373"
"176","8.118223","zoomca129-151-7-84zc.cloud.zoom.us","192.168.0.107","TCP","66","443  >  50240 [ACK] Seq=4425 Ack=829 Win=64384 Len=0 TSval=1776407806 TSecr=532760373"
"177","8.118227","zoomca129-151-8-130zc.cloud.zoom.us","192.168.0.107","TCP","66","443  >  50238 [ACK] Seq=4425 Ack=1502 Win=64256 Len=0 TSval=1622469888 TSecr=532760373"
"178","8.118335","192.168.0.107","zoomca129-151-7-84zc.cloud.zoom.us","TCP","54","50240  >  443 [RST] Seq=829 Win=0 Len=0"
"179","8.118662","zoomca129-151-8-130zc.cloud.zoom.us","192.168.0.107","TCP","66","443  >  50238 [ACK] Seq=4425 Ack=1533 Win=64256 Len=0 TSval=1622469888 TSecr=532760373"
"180","8.151866","zoomva193-123-130-78zc.cloud.zoom.us","192.168.0.107","TCP","66","443  >  50239 [ACK] Seq=4882 Ack=1535 Win=64256 Len=0 TSval=3372083795 TSecr=532760374"
"181","8.151872","zoomca129-151-8-130zc.cloud.zoom.us","192.168.0.107","TCP","66","443  >  50238 [ACK] Seq=4425 Ack=1534 Win=64256 Len=0 TSval=1622469930 TSecr=532760373"
"182","8.151996","zoomva193-123-140-54zc.cloud.zoom.us","192.168.0.107","TCP","66","443  >  50241 [ACK] Seq=4300 Ack=645 Win=64512 Len=0 TSval=1638946167 TSecr=532760374"
"183","8.183205","10.0.25.10","192.168.0.107","DNS","114","Standard query response 0x9e1c A zoomva193-123-143-170mmr.cloud.zoom.us A 193.123.143.170"
"184","8.184269","192.168.0.107","zoomva193-123-143-170mmr.cloud.zoom.us","TCP","78","50242  >  443 [SYN, ECN, CWR] Seq=0 Win=65535 Len=0 MSS=1460 WS=64 TSval=532760489 TSecr=0 SACK_PERM=1"
"185","8.195869","zoomva193-123-143-170mmr.cloud.zoom.us","192.168.0.107","TCP","74","443  >  50242 [SYN, ACK, ECN] Seq=0 Ack=1 Win=65236 Len=0 MSS=1360 SACK_PERM=1 TSval=605908223 TSecr=532760489 WS=128"
"186","8.195987","192.168.0.107","zoomva193-123-143-170mmr.cloud.zoom.us","TCP","66","50242  >  443 [ACK] Seq=1 Ack=1 Win=132096 Len=0 TSval=532760500 TSecr=605908223"
"187","8.196391","192.168.0.107","zoomva193-123-143-170mmr.cloud.zoom.us","TLSv1.2","583","Client Hello"
"188","8.245776","192.168.0.107","zoomva193-123-143-170mmr.cloud.zoom.us","TCP","583","[TCP Retransmission] 50242  >  443 [PSH, ACK] Seq=1 Ack=1 Win=132096 Len=517 TSval=532760549 TSecr=605908223"
"189","8.263312","zoomva193-123-130-78zc.cloud.zoom.us","192.168.0.107","TLSv1.2","97","Encrypted Alert"
"190","8.263450","192.168.0.107","zoomva193-123-130-78zc.cloud.zoom.us","TCP","54","50239  >  443 [RST] Seq=1535 Win=0 Len=0"
"191","8.277781","zoomva193-123-143-170mmr.cloud.zoom.us","192.168.0.107","TCP","66","443  >  50242 [ACK] Seq=1 Ack=518 Win=64512 Len=0 TSval=605908297 TSecr=532760500"
"192","8.277787","zoomva193-123-143-170mmr.cloud.zoom.us","192.168.0.107","TCP","78","[TCP Dup ACK 191#1] 443  >  50242 [ACK] Seq=1 Ack=518 Win=64512 Len=0 TSval=605908304 TSecr=532760549 SLE=1 SRE=518"
"193","8.287509","zoomca129-151-8-130zc.cloud.zoom.us","192.168.0.107","TLSv1.2","511","Application Data"
"194","8.287679","192.168.0.107","zoomca129-151-8-130zc.cloud.zoom.us","TCP","54","50238  >  443 [RST] Seq=1534 Win=0 Len=0"
"195","8.413784","zoomva193-123-140-54zc.cloud.zoom.us","192.168.0.107","TLSv1.2","148","Change Cipher Spec, Encrypted Handshake Message, Encrypted Alert"
"196","8.413922","192.168.0.107","zoomva193-123-140-54zc.cloud.zoom.us","TCP","54","50241  >  443 [RST] Seq=645 Win=0 Len=0"
"197","8.535115","zoomva193-123-143-170mmr.cloud.zoom.us","192.168.0.107","TLSv1.2","1354","Server Hello"
"198","8.536976","zoomva193-123-143-170mmr.cloud.zoom.us","192.168.0.107","TCP","1354","443  >  50242 [ACK] Seq=1289 Ack=518 Win=64512 Len=1288 TSval=605908562 TSecr=532760549 [TCP segment of a reassembled PDU]"
"199","8.537088","192.168.0.107","zoomva193-123-143-170mmr.cloud.zoom.us","TCP","66","50242  >  443 [ACK] Seq=518 Ack=2577 Win=129728 Len=0 TSval=532760836 TSecr=605908562"
"200","8.538840","zoomva193-123-143-170mmr.cloud.zoom.us","192.168.0.107","TCP","1354","443  >  50242 [ACK] Seq=2577 Ack=518 Win=64512 Len=1288 TSval=605908562 TSecr=532760549 [TCP segment of a reassembled PDU]"
"201","8.540967","zoomva193-123-143-170mmr.cloud.zoom.us","192.168.0.107","TLSv1.2","501","Certificate, Server Key Exchange, Server Hello Done"
"202","8.541079","192.168.0.107","zoomva193-123-143-170mmr.cloud.zoom.us","TCP","66","50242  >  443 [ACK] Seq=518 Ack=4300 Win=130624 Len=0 TSval=532760839 TSecr=605908562"
"203","8.553117","192.168.0.107","zoomva193-123-143-170mmr.cloud.zoom.us","TLSv1.2","192","Client Key Exchange, Change Cipher Spec, Encrypted Handshake Message"
"204","8.563894","zoomva193-123-143-170mmr.cloud.zoom.us","192.168.0.107","TCP","66","443  >  50242 [ACK] Seq=4300 Ack=644 Win=64512 Len=0 TSval=605908597 TSecr=532760849"
"205","8.706681","zoomva193-123-143-170mmr.cloud.zoom.us","192.168.0.107","TLSv1.2","117","Change Cipher Spec, Encrypted Handshake Message"
"206","8.706793","192.168.0.107","zoomva193-123-143-170mmr.cloud.zoom.us","TCP","66","50242  >  443 [ACK] Seq=644 Ack=4351 Win=131008 Len=0 TSval=532761002 TSecr=605908736"
"207","8.707217","192.168.0.107","zoomva193-123-143-170mmr.cloud.zoom.us","TLSv1.2","222","Application Data"
"208","8.726675","zoomva193-123-143-170mmr.cloud.zoom.us","192.168.0.107","TCP","66","443  >  50242 [ACK] Seq=4351 Ack=800 Win=64384 Len=0 TSval=605908754 TSecr=532761002"
"209","8.876402","zoomva193-123-143-170mmr.cloud.zoom.us","192.168.0.107","TLSv1.2","140","Application Data"
"210","8.876514","192.168.0.107","zoomva193-123-143-170mmr.cloud.zoom.us","TCP","66","50242  >  443 [ACK] Seq=800 Ack=4425 Win=130944 Len=0 TSval=532761169 TSecr=605908900"
"211","8.881755","192.168.0.107","zoomva193-123-143-170mmr.cloud.zoom.us","TCP","1414","50242  >  443 [ACK] Seq=800 Ack=4425 Win=131072 Len=1348 TSval=532761174 TSecr=605908900 [TCP segment of a reassembled PDU]"
"212","8.881756","192.168.0.107","zoomva193-123-143-170mmr.cloud.zoom.us","TLSv1.2","1274","Application Data"
"213","8.912450","zoomva193-123-143-170mmr.cloud.zoom.us","192.168.0.107","TCP","66","443  >  50242 [ACK] Seq=4425 Ack=2148 Win=64256 Len=0 TSval=605908928 TSecr=532761174"
"214","8.919256","zoomva193-123-143-170mmr.cloud.zoom.us","192.168.0.107","TCP","66","443  >  50242 [ACK] Seq=4425 Ack=3356 Win=64256 Len=0 TSval=605908942 TSecr=532761174"
"215","9.074420","zoomva193-123-143-170mmr.cloud.zoom.us","192.168.0.107","TLSv1.2","116","Application Data"
"216","9.074524","192.168.0.107","zoomva193-123-143-170mmr.cloud.zoom.us","TCP","66","50242  >  443 [ACK] Seq=3356 Ack=4475 Win=131008 Len=0 TSval=532761363 TSecr=605909096"
"217","9.126957","zoomva193-123-143-170mmr.cloud.zoom.us","192.168.0.107","TCP","1354","443  >  50242 [ACK] Seq=4475 Ack=3356 Win=64256 Len=1288 TSval=605909158 TSecr=532761363 [TCP segment of a reassembled PDU]"
"218","9.129072","zoomva193-123-143-170mmr.cloud.zoom.us","192.168.0.107","TLSv1.2","1354","Application Data, Application Data"
"219","9.129079","zoomva193-123-143-170mmr.cloud.zoom.us","192.168.0.107","TLSv1.2","1354","Application Data [TCP segment of a reassembled PDU]"
"220","9.129186","192.168.0.107","zoomva193-123-143-170mmr.cloud.zoom.us","TCP","66","50242  >  443 [ACK] Seq=3356 Ack=7051 Win=129728 Len=0 TSval=532761417 TSecr=605909158"
"221","9.129525","192.168.0.107","zoomva193-123-143-170mmr.cloud.zoom.us","TLSv1.2","116","Application Data"
"222","9.130829","zoomva193-123-143-170mmr.cloud.zoom.us","192.168.0.107","TLSv1.2","1354","Application Data, Application Data, Application Data, Application Data"
"223","9.131893","zoomva193-123-143-170mmr.cloud.zoom.us","192.168.0.107","TLSv1.2","520","Application Data"
"224","9.131979","192.168.0.107","zoomva193-123-143-170mmr.cloud.zoom.us","TCP","66","50242  >  443 [ACK] Seq=3406 Ack=10081 Win=130560 Len=0 TSval=532761419 TSecr=605909158"
"225","9.140212","192.168.0.107","zoomva193-123-143-170mmr.cloud.zoom.us","TLSv1.2","116","Application Data"
"226","9.150120","zoomva193-123-143-170mmr.cloud.zoom.us","192.168.0.107","TCP","66","443  >  50242 [ACK] Seq=10081 Ack=3406 Win=64256 Len=0 TSval=605909180 TSecr=532761417"
"227","9.152351","zoomva193-123-143-170mmr.cloud.zoom.us","192.168.0.107","TCP","66","443  >  50242 [ACK] Seq=10081 Ack=3456 Win=64256 Len=0 TSval=605909186 TSecr=532761426"
"228","9.158020","192.168.0.107","zoomva193-123-143-170mmr.cloud.zoom.us","TLSv1.2","449","Application Data"
"229","9.158089","192.168.0.107","zoomva193-123-143-170mmr.cloud.zoom.us","TLSv1.2","385","Application Data"
"230","9.158165","192.168.0.107","zoomva193-123-143-170mmr.cloud.zoom.us","TLSv1.2","339","Application Data"
"231","9.158216","192.168.0.107","zoomva193-123-143-170mmr.cloud.zoom.us","TLSv1.2","326","Application Data"
"232","9.158283","192.168.0.107","zoomva193-123-143-170mmr.cloud.zoom.us","TLSv1.2","347","Application Data"
"233","9.158376","192.168.0.107","zoomva193-123-143-170mmr.cloud.zoom.us","TLSv1.2","226","Application Data"
"234","9.189576","zoomva193-123-143-170mmr.cloud.zoom.us","192.168.0.107","TCP","66","443  >  50242 [ACK] Seq=10081 Ack=3839 Win=64256 Len=0 TSval=605909206 TSecr=532761443"
"235","9.189954","zoomva193-123-143-170mmr.cloud.zoom.us","192.168.0.107","TCP","66","443  >  50242 [ACK] Seq=10081 Ack=4158 Win=64256 Len=0 TSval=605909216 TSecr=532761443"
"236","9.189957","zoomva193-123-143-170mmr.cloud.zoom.us","192.168.0.107","TCP","66","443  >  50242 [ACK] Seq=10081 Ack=4431 Win=64256 Len=0 TSval=605909216 TSecr=532761443"
"237","9.190338","zoomva193-123-143-170mmr.cloud.zoom.us","192.168.0.107","TCP","66","443  >  50242 [ACK] Seq=10081 Ack=4691 Win=64256 Len=0 TSval=605909216 TSecr=532761443"
"238","9.190340","zoomva193-123-143-170mmr.cloud.zoom.us","192.168.0.107","TCP","66","443  >  50242 [ACK] Seq=10081 Ack=4972 Win=64256 Len=0 TSval=605909216 TSecr=532761443"
"239","9.190519","zoomva193-123-143-170mmr.cloud.zoom.us","192.168.0.107","TCP","66","443  >  50242 [ACK] Seq=10081 Ack=5132 Win=64256 Len=0 TSval=605909216 TSecr=532761443"
"240","9.212232","192.168.0.107","zoomva193-123-143-170mmr.cloud.zoom.us","TLSv1.2","268","Application Data"
"241","9.212296","192.168.0.107","zoomva193-123-143-170mmr.cloud.zoom.us","TLSv1.2","273","Application Data"
"242","9.213870","192.168.0.107","zoomva193-123-143-170mmr.cloud.zoom.us","TLSv1.2","317","Application Data"
"243","9.213934","192.168.0.107","zoomva193-123-143-170mmr.cloud.zoom.us","TLSv1.2","381","Application Data"
"244","9.213934","192.168.0.107","zoomva193-123-143-170mmr.cloud.zoom.us","TCP","1414","50242  >  443 [ACK] Seq=6107 Ack=10081 Win=131072 Len=1348 TSval=532761497 TSecr=605909216 [TCP segment of a reassembled PDU]"
"245","9.213935","192.168.0.107","zoomva193-123-143-170mmr.cloud.zoom.us","TLSv1.2","222","Application Data"
"246","9.213960","192.168.0.107","zoomva193-123-143-170mmr.cloud.zoom.us","TLSv1.2","492","Application Data"
"247","9.214003","192.168.0.107","zoomva193-123-143-170mmr.cloud.zoom.us","TLSv1.2","358","Application Data"
"248","9.214074","192.168.0.107","zoomva193-123-143-170mmr.cloud.zoom.us","TLSv1.2","443","Application Data"
"249","9.214599","192.168.0.107","zoomva193-123-143-170mmr.cloud.zoom.us","TLSv1.2","501","Application Data"
"250","9.214734","192.168.0.107","zoomva193-123-143-170mmr.cloud.zoom.us","TLSv1.2","1238","Application Data"
"251","9.217092","192.168.0.107","zoomva193-123-143-170mmr.cloud.zoom.us","TLSv1.2","300","Application Data"
"252","9.217155","192.168.0.107","zoomva193-123-143-170mmr.cloud.zoom.us","TLSv1.2","355","Application Data"
"253","9.217155","192.168.0.107","zoomva193-123-143-170mmr.cloud.zoom.us","TLSv1.2","357","Application Data"
"254","9.217173","192.168.0.107","zoomva193-123-143-170mmr.cloud.zoom.us","TLSv1.2","371","Application Data"
"255","9.217182","192.168.0.107","zoomva193-123-143-170mmr.cloud.zoom.us","TLSv1.2","456","Application Data"
"256","9.217208","192.168.0.107","zoomva193-123-143-170mmr.cloud.zoom.us","TLSv1.2","455","Application Data"
"257","9.217251","192.168.0.107","zoomva193-123-143-170mmr.cloud.zoom.us","TLSv1.2","457","Application Data"
"258","9.217252","192.168.0.107","zoomva193-123-143-170mmr.cloud.zoom.us","TLSv1.2","457","Application Data"
"259","9.217267","192.168.0.107","zoomva193-123-143-170mmr.cloud.zoom.us","TLSv1.2","1013","Application Data"
"260","9.255846","zoomva193-123-143-170mmr.cloud.zoom.us","192.168.0.107","TCP","66","443  >  50242 [ACK] Seq=10081 Ack=5334 Win=64256 Len=0 TSval=605909276 TSecr=532761496"
"261","9.256320","zoomva193-123-143-170mmr.cloud.zoom.us","192.168.0.107","TCP","66","443  >  50242 [ACK] Seq=10081 Ack=5541 Win=64256 Len=0 TSval=605909276 TSecr=532761496"
"262","9.256324","zoomva193-123-143-170mmr.cloud.zoom.us","192.168.0.107","TCP","66","443  >  50242 [ACK] Seq=10081 Ack=5792 Win=64256 Len=0 TSval=605909276 TSecr=532761497"
"263","9.256379","192.168.0.107","zoomva193-123-143-170mmr.cloud.zoom.us","TLSv1.2","1414","Application Data, Application Data, Application Data"
"264","9.258884","zoomva193-123-143-170mmr.cloud.zoom.us","192.168.0.107","TCP","66","443  >  50242 [ACK] Seq=10081 Ack=7455 Win=62720 Len=0 TSval=605909276 TSecr=532761497"
"265","9.258886","zoomva193-123-143-170mmr.cloud.zoom.us","192.168.0.107","TCP","66","443  >  50242 [ACK] Seq=10081 Ack=7611 Win=64256 Len=0 TSval=605909277 TSecr=532761497"
"266","9.258964","192.168.0.107","zoomva193-123-143-170mmr.cloud.zoom.us","TLSv1.2","1414","Application Data, Application Data, Application Data"
"267","9.258964","192.168.0.107","zoomva193-123-143-170mmr.cloud.zoom.us","TLSv1.2","1414","Application Data, Application Data, Application Data"
"268","9.259257","zoomva193-123-143-170mmr.cloud.zoom.us","192.168.0.107","TCP","66","443  >  50242 [ACK] Seq=10081 Ack=8037 Win=64256 Len=0 TSval=605909277 TSecr=532761497"
"269","9.259260","zoomva193-123-143-170mmr.cloud.zoom.us","192.168.0.107","TCP","66","443  >  50242 [ACK] Seq=10081 Ack=8329 Win=64256 Len=0 TSval=605909277 TSecr=532761497"
"270","9.259314","192.168.0.107","zoomva193-123-143-170mmr.cloud.zoom.us","TLSv1.2","1414","Application Data, Application Data, Application Data"
"271","9.259864","zoomva193-123-143-170mmr.cloud.zoom.us","192.168.0.107","TCP","66","443  >  50242 [ACK] Seq=10081 Ack=8706 Win=64256 Len=0 TSval=605909278 TSecr=532761497"
"272","9.259913","192.168.0.107","zoomva193-123-143-170mmr.cloud.zoom.us","TLSv1.2","1414","Application Data, Application Data, Application Data, Application Data"
"273","9.260376","zoomva193-123-143-170mmr.cloud.zoom.us","192.168.0.107","TCP","66","443  >  50242 [ACK] Seq=10081 Ack=10313 Win=64256 Len=0 TSval=605909278 TSecr=532761497"
"274","9.260429","192.168.0.107","zoomva193-123-143-170mmr.cloud.zoom.us","TLSv1.2","1414","Application Data, Application Data"
"275","9.260431","192.168.0.107","zoomva193-123-143-170mmr.cloud.zoom.us","TLSv1.2","1414","Application Data, Application Data, Application Data"
"276","9.260432","192.168.0.107","zoomva193-123-143-170mmr.cloud.zoom.us","TLSv1.2","231","Application Data"
"277","9.265651","zoomva193-123-143-170mmr.cloud.zoom.us","192.168.0.107","TCP","66","443  >  50242 [ACK] Seq=10081 Ack=11127 Win=64256 Len=0 TSval=605909291 TSecr=532761500"
"278","9.265654","zoomva193-123-143-170mmr.cloud.zoom.us","192.168.0.107","TCP","66","443  >  50242 [ACK] Seq=10081 Ack=12211 Win=64256 Len=0 TSval=605909291 TSecr=532761500"
"279","9.270095","zoomva193-123-143-170mmr.cloud.zoom.us","192.168.0.107","TCP","66","443  >  50242 [ACK] Seq=10081 Ack=12993 Win=64256 Len=0 TSval=605909299 TSecr=532761500"
"280","9.270099","zoomva193-123-143-170mmr.cloud.zoom.us","192.168.0.107","TCP","66","443  >  50242 [ACK] Seq=10081 Ack=13940 Win=64256 Len=0 TSval=605909299 TSecr=532761500"
"283","9.298954","zoomva193-123-143-170mmr.cloud.zoom.us","192.168.0.107","TCP","66","443  >  50242 [ACK] Seq=10081 Ack=16636 Win=64256 Len=0 TSval=605909320 TSecr=532761537"
"284","9.308679","zoomva193-123-143-170mmr.cloud.zoom.us","192.168.0.107","TCP","66","443  >  50242 [ACK] Seq=10081 Ack=19332 Win=64256 Len=0 TSval=605909336 TSecr=532761539"
"285","9.308736","zoomva193-123-143-170mmr.cloud.zoom.us","192.168.0.107","TCP","66","443  >  50242 [ACK] Seq=10081 Ack=22028 Win=64256 Len=0 TSval=605909339 TSecr=532761540"
"287","9.310750","zoomva193-123-143-170mmr.cloud.zoom.us","192.168.0.107","TCP","66","443  >  50242 [ACK] Seq=10081 Ack=23541 Win=64256 Len=0 TSval=605909341 TSecr=532761540"
"291","9.337019","zoomva193-123-143-170mmr.cloud.zoom.us","192.168.0.107","TLSv1.2","116","Application Data"
"292","9.337090","192.168.0.107","zoomva193-123-143-170mmr.cloud.zoom.us","TCP","66","50242  >  443 [ACK] Seq=23541 Ack=10131 Win=131008 Len=0 TSval=532761614 TSecr=605909358"
"293","9.346012","zoomva193-123-143-170mmr.cloud.zoom.us","192.168.0.107","TLSv1.2","869","Application Data, Application Data, Application Data, Application Data, Application Data, Application Data"
"294","9.346138","192.168.0.107","zoomva193-123-143-170mmr.cloud.zoom.us","TCP","66","50242  >  443 [ACK] Seq=23541 Ack=10934 Win=130240 Len=0 TSval=532761622 TSecr=605909364"
"295","9.346311","192.168.0.107","zoomva193-123-143-170mmr.cloud.zoom.us","TLSv1.2","116","Application Data"
"296","9.372770","zoomva193-123-143-170mmr.cloud.zoom.us","192.168.0.107","TCP","66","443  >  50242 [ACK] Seq=10934 Ack=23591 Win=64256 Len=0 TSval=605909395 TSecr=532761622"
"298","9.396236","zoomva193-123-143-170mmr.cloud.zoom.us","192.168.0.107","TLSv1.2","1354","Application Data, Application Data, Application Data, Application Data, Application Data, Application Data, Application Data, Application Data"
"299","9.396244","zoomva193-123-143-170mmr.cloud.zoom.us","192.168.0.107","TLSv1.2","612","Application Data, Application Data, Application Data, Application Data, Application Data, Application Data"
"300","9.396374","192.168.0.107","zoomva193-123-143-170mmr.cloud.zoom.us","TCP","66","50242  >  443 [ACK] Seq=23591 Ack=12768 Win=129216 Len=0 TSval=532761671 TSecr=605909425"
"301","9.397338","192.168.0.107","zoomva193-123-143-170mmr.cloud.zoom.us","UDP","165","65102  >  8801 Len=123"
"302","9.399688","zoomva193-123-143-170mmr.cloud.zoom.us","192.168.0.107","TLSv1.2","116","Application Data"
"303","9.399776","192.168.0.107","zoomva193-123-143-170mmr.cloud.zoom.us","TCP","66","50242  >  443 [ACK] Seq=23591 Ack=12818 Win=131008 Len=0 TSval=532761674 TSecr=605909430"
"304","9.399909","192.168.0.107","zoomva193-123-143-170mmr.cloud.zoom.us","TLSv1.2","116","Application Data"
"305","9.415861","192.168.0.107","zoomva193-123-143-170mmr.cloud.zoom.us","TLSv1.2","326","Application Data"
"306","9.417387","192.168.0.107","zoomva193-123-143-170mmr.cloud.zoom.us","TLSv1.2","330","Application Data"
"307","9.422622","zoomva193-123-143-170mmr.cloud.zoom.us","192.168.0.107","TCP","66","443  >  50242 [ACK] Seq=12818 Ack=23641 Win=64256 Len=0 TSval=605909445 TSecr=532761674"
"308","9.434966","zoomva193-123-143-170mmr.cloud.zoom.us","192.168.0.107","TCP","66","443  >  50242 [ACK] Seq=12818 Ack=24165 Win=64256 Len=0 TSval=605909463 TSecr=532761690"
