"No.","Time","Source","Destination","Protocol","Length","Info"
"1","0.000000","192.168.0.107","216.58.208.36","UDP","1392","55247  >  443 Len=1350"
"2","0.003205","192.168.0.107","216.58.208.36","UDP","1392","52604  >  443 Len=1350"
"3","0.106822","216.58.208.36","192.168.0.107","UDP","1392","443  >  55247 Len=1350"
"4","0.107030","216.58.208.36","192.168.0.107","UDP","1392","443  >  52604 Len=1350"
"5","0.108089","192.168.0.107","216.58.208.36","UDP","75","55247  >  443 Len=33"
"6","0.108576","192.168.0.107","216.58.208.36","UDP","75","52604  >  443 Len=33"
"7","0.942064","173.194.76.189","192.168.0.107","UDP","87","443  >  61435 Len=45"
"8","0.964030","192.168.0.107","173.194.76.189","UDP","75","61435  >  443 Len=33"
"9","4.327634","192.168.0.107","10.0.25.10","DNS","91","Standard query 0x2ac5 A browser.pipe.aria.microsoft.com"
"10","4.341180","10.0.25.10","192.168.0.107","DNS","203","Standard query response 0x2ac5 A browser.pipe.aria.microsoft.com CNAME browser.events.data.trafficmanager.net CNAME skypedataprdcolneu00.cloudapp.net A 52.114.77.164"
"11","4.341827","192.168.0.107","52.114.77.164","TCP","78","50590  >  443 [SYN, ECN, CWR] Seq=0 Win=65535 Len=0 MSS=1460 WS=64 TSval=66573965 TSecr=0 SACK_PERM=1"
"12","4.370591","52.114.77.164","192.168.0.107","TCP","74","443  >  50590 [SYN, ACK, ECN] Seq=0 Ack=1 Win=65236 Len=0 MSS=1360 SACK_PERM=1 TSval=2318535023 TSecr=66573965 WS=128"
"13","4.370679","192.168.0.107","52.114.77.164","TCP","66","50590  >  443 [ACK] Seq=1 Ack=1 Win=132096 Len=0 TSval=66573993 TSecr=2318535023"
"14","4.389405","192.168.0.107","52.114.77.164","TLSv1.2","583","Client Hello"
"15","4.457915","192.168.0.107","31.13.84.51","TLSv1.2","958","Application Data"
"16","4.466778","52.114.77.164","192.168.0.107","TCP","66","443  >  50590 [ACK] Seq=1 Ack=518 Win=64512 Len=0 TSval=2318535119 TSecr=66574011"
"17","4.509674","192.168.0.107","31.13.84.51","TLSv1.2","185","Application Data"
"18","4.524133","192.168.0.107","10.0.25.10","DNS","76","Standard query 0xc663 A web.whatsapp.com"
"19","4.537485","10.0.25.10","192.168.0.107","DNS","129","Standard query response 0xc663 A web.whatsapp.com CNAME mmx-ds.cdn.whatsapp.net A 31.13.84.51"
"20","4.537774","192.168.0.107","31.13.84.51","TCP","78","50591  >  443 [SYN, ECN, CWR] Seq=0 Win=65535 Len=0 MSS=1460 WS=64 TSval=66574156 TSecr=0 SACK_PERM=1"
"21","4.550234","31.13.84.51","192.168.0.107","TCP","66","443  >  50379 [ACK] Seq=1 Ack=893 Win=315 Len=0 TSval=2221734608 TSecr=66574079"
"22","4.556847","52.114.77.164","192.168.0.107","TCP","1354","443  >  50590 [ACK] Seq=1 Ack=518 Win=64512 Len=1288 TSval=2318535224 TSecr=66574011 [TCP segment of a reassembled PDU]"
"23","4.557185","52.114.77.164","192.168.0.107","TCP","1354","443  >  50590 [ACK] Seq=1289 Ack=518 Win=64512 Len=1288 TSval=2318535224 TSecr=66574011 [TCP segment of a reassembled PDU]"
"24","4.557236","192.168.0.107","52.114.77.164","TCP","66","50590  >  443 [ACK] Seq=518 Ack=2577 Win=129728 Len=0 TSval=66574174 TSecr=2318535224"
"25","4.558864","52.114.77.164","192.168.0.107","TCP","1354","443  >  50590 [ACK] Seq=2577 Ack=518 Win=64512 Len=1288 TSval=2318535224 TSecr=66574011 [TCP segment of a reassembled PDU]"
"26","4.559200","52.114.77.164","192.168.0.107","TCP","1354","443  >  50590 [ACK] Seq=3865 Ack=518 Win=64512 Len=1288 TSval=2318535224 TSecr=66574011 [TCP segment of a reassembled PDU]"
"27","4.559256","192.168.0.107","52.114.77.164","TCP","66","50590  >  443 [ACK] Seq=518 Ack=5153 Win=129728 Len=0 TSval=66574176 TSecr=2318535224"
"28","4.560639","52.114.77.164","192.168.0.107","TLSv1.2","1157","Server Hello, Certificate, Certificate Status, Server Key Exchange, Server Hello Done"
"29","4.560723","192.168.0.107","52.114.77.164","TCP","66","50590  >  443 [ACK] Seq=518 Ack=6244 Win=129920 Len=0 TSval=66574177 TSecr=2318535224"
"30","4.563674","192.168.0.107","52.114.77.164","TLSv1.2","159","Client Key Exchange, Change Cipher Spec, Encrypted Handshake Message"
"31","4.581786","52.114.77.164","192.168.0.107","TCP","66","443  >  50590 [ACK] Seq=6244 Ack=611 Win=64512 Len=0 TSval=2318535242 TSecr=66574179"
"32","4.614199","31.13.84.51","192.168.0.107","TCP","66","443  >  50379 [ACK] Seq=1 Ack=1012 Win=315 Len=0 TSval=2221734661 TSecr=66574129"
"33","4.626721","31.13.84.51","192.168.0.107","TCP","74","443  >  50591 [SYN, ACK] Seq=0 Ack=1 Win=65535 Len=0 MSS=1360 SACK_PERM=1 TSval=3689109484 TSecr=66574156 WS=256"
"34","4.626797","192.168.0.107","31.13.84.51","TCP","66","50591  >  443 [ACK] Seq=1 Ack=1 Win=132096 Len=0 TSval=66574241 TSecr=3689109484"
"35","4.627087","192.168.0.107","31.13.84.51","TLSv1.3","583","Client Hello"
"36","4.655273","52.114.77.164","192.168.0.107","TLSv1.2","117","Change Cipher Spec, Encrypted Handshake Message"
"37","4.655343","192.168.0.107","52.114.77.164","TCP","66","50590  >  443 [ACK] Seq=611 Ack=6295 Win=131008 Len=0 TSval=66574269 TSecr=2318535314"
"38","4.655718","192.168.0.107","52.114.77.164","TLSv1.2","868","Application Data"
"39","4.655923","192.168.0.107","52.114.77.164","TCP","1414","50590  >  443 [ACK] Seq=1413 Ack=6295 Win=131072 Len=1348 TSval=66574269 TSecr=2318535314 [TCP segment of a reassembled PDU]"
"40","4.655925","192.168.0.107","52.114.77.164","TCP","1414","50590  >  443 [ACK] Seq=2761 Ack=6295 Win=131072 Len=1348 TSval=66574269 TSecr=2318535314 [TCP segment of a reassembled PDU]"
"41","4.656005","192.168.0.107","52.114.77.164","TCP","1414","50590  >  443 [ACK] Seq=4109 Ack=6295 Win=131072 Len=1348 TSval=66574269 TSecr=2318535314 [TCP segment of a reassembled PDU]"
"42","4.676061","31.13.84.51","192.168.0.107","TLSv1.2","99","Application Data"
"43","4.676170","192.168.0.107","31.13.84.51","TCP","66","50379  >  443 [ACK] Seq=1012 Ack=34 Win=2047 Len=0 TSval=66574289 TSecr=2221734720"
"44","4.697374","52.114.77.164","192.168.0.107","TCP","66","443  >  50590 [ACK] Seq=6295 Ack=1413 Win=64256 Len=0 TSval=2318535356 TSecr=66574269"
"45","4.697379","52.114.77.164","192.168.0.107","TCP","66","443  >  50590 [ACK] Seq=6295 Ack=4109 Win=63360 Len=0 TSval=2318535356 TSecr=66574269"
"46","4.697562","52.114.77.164","192.168.0.107","TCP","66","443  >  50590 [ACK] Seq=6295 Ack=5457 Win=62336 Len=0 TSval=2318535356 TSecr=66574269"
"47","4.697585","192.168.0.107","52.114.77.164","TCP","1414","50590  >  443 [ACK] Seq=5457 Ack=6295 Win=131072 Len=1348 TSval=66574310 TSecr=2318535356 [TCP segment of a reassembled PDU]"
"48","4.697586","192.168.0.107","52.114.77.164","TCP","1414","50590  >  443 [ACK] Seq=6805 Ack=6295 Win=131072 Len=1348 TSval=66574310 TSecr=2318535356 [TCP segment of a reassembled PDU]"
"49","4.697587","192.168.0.107","52.114.77.164","TCP","1414","50590  >  443 [ACK] Seq=8153 Ack=6295 Win=131072 Len=1348 TSval=66574310 TSecr=2318535356 [TCP segment of a reassembled PDU]"
"50","4.697587","192.168.0.107","52.114.77.164","TCP","1414","50590  >  443 [ACK] Seq=9501 Ack=6295 Win=131072 Len=1348 TSval=66574310 TSecr=2318535356 [TCP segment of a reassembled PDU]"
"51","4.697588","192.168.0.107","52.114.77.164","TCP","1414","50590  >  443 [ACK] Seq=10849 Ack=6295 Win=131072 Len=1348 TSval=66574310 TSecr=2318535356 [TCP segment of a reassembled PDU]"
"52","4.697589","192.168.0.107","52.114.77.164","TLSv1.2","324","Application Data"
"53","4.713502","31.13.84.51","192.168.0.107","TLSv1.2","99","Application Data"
"54","4.713508","52.114.77.164","192.168.0.107","TCP","66","443  >  50590 [ACK] Seq=6295 Ack=6805 Win=64256 Len=0 TSval=2318535382 TSecr=66574310"
"55","4.713623","192.168.0.107","31.13.84.51","TCP","66","50379  >  443 [ACK] Seq=1012 Ack=67 Win=2047 Len=0 TSval=66574326 TSecr=2221734769"
"56","4.715141","31.13.84.51","192.168.0.107","TCP","66","443  >  50591 [ACK] Seq=1 Ack=518 Win=66816 Len=0 TSval=3689109581 TSecr=66574241"
"57","4.717669","31.13.84.51","192.168.0.107","TLSv1.3","278","Server Hello, Change Cipher Spec, Application Data"
"58","4.717773","192.168.0.107","31.13.84.51","TCP","66","50591  >  443 [ACK] Seq=518 Ack=213 Win=131840 Len=0 TSval=66574329 TSecr=3689109582"
"59","4.719669","192.168.0.107","31.13.84.51","TLSv1.3","130","Change Cipher Spec, Application Data"
"60","4.719854","192.168.0.107","31.13.84.51","TLSv1.3","158","Application Data"
"61","4.720205","192.168.0.107","31.13.84.51","TLSv1.3","377","Application Data"
"62","4.737580","52.114.77.164","192.168.0.107","TCP","66","443  >  50590 [ACK] Seq=6295 Ack=8153 Win=64256 Len=0 TSval=2318535405 TSecr=66574310"
"63","4.760355","52.114.77.164","192.168.0.107","TCP","66","443  >  50590 [ACK] Seq=6295 Ack=9501 Win=64256 Len=0 TSval=2318535427 TSecr=66574310"
"64","4.760359","52.114.77.164","192.168.0.107","TCP","66","443  >  50590 [ACK] Seq=6295 Ack=10849 Win=63360 Len=0 TSval=2318535427 TSecr=66574310"
"65","4.760407","52.114.77.164","192.168.0.107","TCP","66","443  >  50590 [ACK] Seq=6295 Ack=12455 Win=63360 Len=0 TSval=2318535427 TSecr=66574310"
"66","4.827931","31.13.84.51","192.168.0.107","TCP","66","443  >  50591 [ACK] Seq=213 Ack=582 Win=66816 Len=0 TSval=3689109692 TSecr=66574330"
"67","4.828256","31.13.84.51","192.168.0.107","TCP","66","443  >  50591 [ACK] Seq=213 Ack=674 Win=66816 Len=0 TSval=3689109692 TSecr=66574330"
"68","4.828359","31.13.84.51","192.168.0.107","TCP","66","443  >  50591 [ACK] Seq=213 Ack=985 Win=67840 Len=0 TSval=3689109692 TSecr=66574330"
"69","4.828364","31.13.84.51","192.168.0.107","TLSv1.3","223","Application Data"
"70","4.828477","192.168.0.107","31.13.84.51","TCP","66","50591  >  443 [ACK] Seq=985 Ack=370 Win=131712 Len=0 TSval=66574437 TSecr=3689109692"
"71","4.831359","31.13.84.51","192.168.0.107","TLSv1.3","146","Application Data"
"72","4.831367","31.13.84.51","192.168.0.107","TLSv1.3","110","Application Data"
"73","4.831538","192.168.0.107","31.13.84.51","TCP","66","50591  >  443 [ACK] Seq=985 Ack=450 Win=131648 Len=0 TSval=66574440 TSecr=3689109692"
"74","4.831539","192.168.0.107","31.13.84.51","TCP","66","50591  >  443 [ACK] Seq=985 Ack=494 Win=131584 Len=0 TSval=66574440 TSecr=3689109693"
"75","4.832211","52.114.77.164","192.168.0.107","TLSv1.2","492","Application Data"
"76","4.832330","192.168.0.107","31.13.84.51","TLSv1.3","97","Application Data"
"77","4.832331","192.168.0.107","52.114.77.164","TCP","66","50590  >  443 [ACK] Seq=12455 Ack=6721 Win=130624 Len=0 TSval=66574440 TSecr=2318535500"
"78","4.899511","31.13.84.51","192.168.0.107","TLSv1.3","1354","Application Data"
"79","4.899586","192.168.0.107","31.13.84.51","TCP","66","50591  >  443 [ACK] Seq=1016 Ack=1782 Win=130304 Len=0 TSval=66574507 TSecr=3689109763"
"80","4.915544","31.13.84.51","192.168.0.107","TCP","66","443  >  50591 [ACK] Seq=1782 Ack=1016 Win=67840 Len=0 TSval=3689109777 TSecr=66574440"
"81","5.092740","31.13.84.51","192.168.0.107","TLSv1.2","101","Application Data"
"82","5.092846","192.168.0.107","31.13.84.51","TCP","66","50379  >  443 [ACK] Seq=1012 Ack=102 Win=2047 Len=0 TSval=66574700 TSecr=2221735150"
"83","5.842060","192.168.0.107","52.114.77.164","TLSv1.2","868","Application Data"
"84","5.842753","192.168.0.107","52.114.77.164","TCP","1414","50590  >  443 [ACK] Seq=13257 Ack=6721 Win=131072 Len=1348 TSval=66575448 TSecr=2318535500 [TCP segment of a reassembled PDU]"
"85","5.842753","192.168.0.107","52.114.77.164","TCP","1414","50590  >  443 [ACK] Seq=14605 Ack=6721 Win=131072 Len=1348 TSval=66575448 TSecr=2318535500 [TCP segment of a reassembled PDU]"
"86","5.842754","192.168.0.107","52.114.77.164","TCP","1414","50590  >  443 [ACK] Seq=15953 Ack=6721 Win=131072 Len=1348 TSval=66575448 TSecr=2318535500 [TCP segment of a reassembled PDU]"
"87","5.842755","192.168.0.107","52.114.77.164","TCP","1414","50590  >  443 [ACK] Seq=17301 Ack=6721 Win=131072 Len=1348 TSval=66575448 TSecr=2318535500 [TCP segment of a reassembled PDU]"
"88","5.842755","192.168.0.107","52.114.77.164","TCP","1414","50590  >  443 [ACK] Seq=18649 Ack=6721 Win=131072 Len=1348 TSval=66575448 TSecr=2318535500 [TCP segment of a reassembled PDU]"
"89","5.842756","192.168.0.107","52.114.77.164","TCP","1414","50590  >  443 [ACK] Seq=19997 Ack=6721 Win=131072 Len=1348 TSval=66575448 TSecr=2318535500 [TCP segment of a reassembled PDU]"
"90","5.842756","192.168.0.107","52.114.77.164","TCP","1414","50590  >  443 [ACK] Seq=21345 Ack=6721 Win=131072 Len=1348 TSval=66575448 TSecr=2318535500 [TCP segment of a reassembled PDU]"
"91","5.875154","52.114.77.164","192.168.0.107","TCP","66","443  >  50590 [ACK] Seq=6721 Ack=13257 Win=64256 Len=0 TSval=2318536535 TSecr=66575448"
"92","5.875254","192.168.0.107","52.114.77.164","TCP","1414","50590  >  443 [ACK] Seq=22693 Ack=6721 Win=131072 Len=1348 TSval=66575480 TSecr=2318536535 [TCP segment of a reassembled PDU]"
"93","5.875255","192.168.0.107","52.114.77.164","TLSv1.2","324","Application Data"
"94","5.875490","52.114.77.164","192.168.0.107","TCP","66","443  >  50590 [ACK] Seq=6721 Ack=17301 Win=62336 Len=0 TSval=2318536535 TSecr=66575448"
"95","5.875492","52.114.77.164","192.168.0.107","TCP","66","443  >  50590 [ACK] Seq=6721 Ack=19997 Win=63360 Len=0 TSval=2318536535 TSecr=66575448"
"96","5.876587","52.114.77.164","192.168.0.107","TCP","66","443  >  50590 [ACK] Seq=6721 Ack=21345 Win=63232 Len=0 TSval=2318536535 TSecr=66575448"
"97","5.876957","52.114.77.164","192.168.0.107","TCP","66","443  >  50590 [ACK] Seq=6721 Ack=22693 Win=64256 Len=0 TSval=2318536536 TSecr=66575448"
"98","5.893428","52.114.77.164","192.168.0.107","TCP","66","443  >  50590 [ACK] Seq=6721 Ack=24299 Win=63360 Len=0 TSval=2318536562 TSecr=66575480"
"99","5.908564","192.168.0.107","10.0.25.10","DNS","75","Standard query 0xef6d A us02web.zoom.us"
"100","5.908860","192.168.0.107","10.0.25.10","DNS","75","Standard query 0x69c9 A us02st1.zoom.us"
"101","5.909232","192.168.0.107","10.0.25.10","DNS","75","Standard query 0xfc92 A us02st3.zoom.us"
"102","5.920109","10.0.25.10","192.168.0.107","DNS","181","Standard query response 0x69c9 A us02st1.zoom.us CNAME dvbgjdmoemnwz.cloudfront.net A 13.32.145.78 A 13.32.145.116 A 13.32.145.7 A 13.32.145.75"
"103","5.927618","192.168.0.107","13.32.145.78","TCP","78","50592  >  443 [SYN, ECN, CWR] Seq=0 Win=65535 Len=0 MSS=1460 WS=64 TSval=66575530 TSecr=0 SACK_PERM=1"
"104","5.931390","192.168.0.107","10.0.25.10","DNS","75","Standard query 0x6548 A us02st2.zoom.us"
"105","5.938785","13.32.145.78","192.168.0.107","TCP","74","443  >  50592 [SYN, ACK, ECN] Seq=0 Ack=1 Win=65236 Len=0 MSS=1360 SACK_PERM=1 TSval=4243332310 TSecr=66575530 WS=128"
"106","5.938864","192.168.0.107","13.32.145.78","TCP","66","50592  >  443 [ACK] Seq=1 Ack=1 Win=132096 Len=0 TSval=66575541 TSecr=4243332310"
"107","5.939139","192.168.0.107","13.32.145.78","TLSv1.3","583","Client Hello"
"108","5.964929","52.114.77.164","192.168.0.107","TLSv1.2","491","Application Data"
"109","5.965139","192.168.0.107","52.114.77.164","TCP","66","50590  >  443 [ACK] Seq=24299 Ack=7146 Win=130624 Len=0 TSval=66575566 TSecr=2318536634"
"110","5.985539","10.0.25.10","192.168.0.107","DNS","181","Standard query response 0xfc92 A us02st3.zoom.us CNAME dvbgjdmoemnwz.cloudfront.net A 13.32.145.75 A 13.32.145.7 A 13.32.145.78 A 13.32.145.116"
"111","5.986180","192.168.0.107","13.32.145.75","TCP","78","50593  >  443 [SYN, ECN, CWR] Seq=0 Win=65535 Len=0 MSS=1460 WS=64 TSval=66575587 TSecr=0 SACK_PERM=1"
"112","5.986777","192.168.0.107","10.0.25.10","DNS","75","Standard query 0x2606 A www.gstatic.com"
"113","5.989633","192.168.0.107","13.32.145.78","TCP","583","[TCP Retransmission] 50592  >  443 [PSH, ACK] Seq=1 Ack=1 Win=132096 Len=517 TSval=66575590 TSecr=4243332310"
"114","5.993910","10.0.25.10","192.168.0.107","DNS","91","Standard query response 0xef6d A us02web.zoom.us A 3.235.73.95"
"115","5.994329","192.168.0.107","3.235.73.95","TCP","78","50594  >  443 [SYN, ECN, CWR] Seq=0 Win=65535 Len=0 MSS=1460 WS=64 TSval=66575594 TSecr=0 SACK_PERM=1"
"116","5.997027","192.168.0.107","10.0.25.10","DNS","77","Standard query 0x9b67 A fonts.gstatic.com"
"117","6.003851","13.32.145.78","192.168.0.107","TCP","66","443  >  50592 [ACK] Seq=1 Ack=518 Win=64512 Len=0 TSval=4243332409 TSecr=66575541"
"118","6.007939","10.0.25.10","192.168.0.107","DNS","181","Standard query response 0x6548 A us02st2.zoom.us CNAME dvbgjdmoemnwz.cloudfront.net A 13.32.145.78 A 13.32.145.116 A 13.32.145.75 A 13.32.145.7"
"119","6.008510","13.32.145.75","192.168.0.107","TCP","74","443  >  50593 [SYN, ACK, ECN] Seq=0 Ack=1 Win=65236 Len=0 MSS=1360 SACK_PERM=1 TSval=2566555139 TSecr=66575587 WS=128"
"120","6.008513","13.32.145.78","192.168.0.107","TCP","78","[TCP Dup ACK 117#1] 443  >  50592 [ACK] Seq=1 Ack=518 Win=64512 Len=0 TSval=4243332423 TSecr=66575590 SLE=1 SRE=518"
"121","6.008588","192.168.0.107","13.32.145.75","TCP","66","50593  >  443 [ACK] Seq=1 Ack=1 Win=132096 Len=0 TSval=66575607 TSecr=2566555139"
"122","6.008783","10.0.25.10","192.168.0.107","DNS","91","Standard query response 0x2606 A www.gstatic.com A 216.58.212.163"
"123","6.008849","192.168.0.107","13.32.145.78","TCP","78","50595  >  443 [SYN, ECN, CWR] Seq=0 Win=65535 Len=0 MSS=1460 WS=64 TSval=66575607 TSecr=0 SACK_PERM=1"
"124","6.009014","10.0.25.10","192.168.0.107","DNS","129","Standard query response 0x9b67 A fonts.gstatic.com CNAME gstaticadssl.l.google.com A 216.58.212.131"
"125","6.009085","192.168.0.107","13.32.145.75","TLSv1.3","583","Client Hello"
"126","6.009448","3.235.73.95","192.168.0.107","TCP","74","443  >  50594 [SYN, ACK, ECN] Seq=0 Ack=1 Win=65236 Len=0 MSS=1360 SACK_PERM=1 TSval=2174456082 TSecr=66575594 WS=128"
"127","6.009535","192.168.0.107","3.235.73.95","TCP","66","50594  >  443 [ACK] Seq=1 Ack=1 Win=132096 Len=0 TSval=66575607 TSecr=2174456082"
"128","6.009959","192.168.0.107","3.235.73.95","TLSv1.2","583","Client Hello"
"129","6.012632","192.168.0.107","216.58.212.131","QUIC","1392","Initial, DCID=61e05a1e12154ea2"
"130","6.022097","192.168.0.107","216.58.212.163","UDP","1392","59404  >  443 Len=1350"
"131","6.043032","13.32.145.78","192.168.0.107","TCP","74","443  >  50595 [SYN, ACK, ECN] Seq=0 Ack=1 Win=65236 Len=0 MSS=1360 SACK_PERM=1 TSval=4243332438 TSecr=66575607 WS=128"
"132","6.043128","192.168.0.107","13.32.145.78","TCP","66","50595  >  443 [ACK] Seq=1 Ack=1 Win=132096 Len=0 TSval=66575640 TSecr=4243332438"
"133","6.043465","192.168.0.107","13.32.145.78","TLSv1.3","583","Client Hello"
"134","6.067984","13.32.145.78","192.168.0.107","TLSv1.3","1354","Server Hello, Change Cipher Spec, Application Data"
"135","6.069511","13.32.145.78","192.168.0.107","TCP","1354","443  >  50592 [ACK] Seq=1289 Ack=518 Win=64512 Len=1288 TSval=4243332486 TSecr=66575590 [TCP segment of a reassembled PDU]"
"136","6.069599","192.168.0.107","13.32.145.78","TCP","66","50592  >  443 [ACK] Seq=518 Ack=2577 Win=129728 Len=0 TSval=66575665 TSecr=4243332486"
"137","6.071768","192.168.0.107","3.235.73.95","TCP","583","[TCP Retransmission] 50594  >  443 [PSH, ACK] Seq=1 Ack=1 Win=132096 Len=517 TSval=66575667 TSecr=2174456082"
"138","6.085894","13.32.145.78","192.168.0.107","TCP","1354","443  >  50592 [ACK] Seq=2577 Ack=518 Win=64512 Len=1288 TSval=4243332486 TSecr=66575590 [TCP segment of a reassembled PDU]"
"139","6.092016","13.32.145.78","192.168.0.107","TCP","366","443  >  50592 [PSH, ACK] Seq=3865 Ack=518 Win=64512 Len=300 TSval=4243332486 TSecr=66575590 [TCP segment of a reassembled PDU]"
"140","6.092128","192.168.0.107","13.32.145.78","TCP","66","50592  >  443 [ACK] Seq=518 Ack=4165 Win=130752 Len=0 TSval=66575687 TSecr=4243332486"
"141","6.096075","13.32.145.78","192.168.0.107","TLSv1.3","771","Application Data, Application Data, Application Data"
"142","6.096175","192.168.0.107","13.32.145.78","TCP","66","50592  >  443 [ACK] Seq=518 Ack=4870 Win=130304 Len=0 TSval=66575691 TSecr=4243332488"
"143","6.102462","192.168.0.107","13.32.145.75","TCP","583","[TCP Retransmission] 50593  >  443 [PSH, ACK] Seq=1 Ack=1 Win=132096 Len=517 TSval=66575697 TSecr=2566555139"
"144","6.105801","192.168.0.107","13.32.145.78","TLSv1.3","130","Change Cipher Spec, Application Data"
"145","6.110098","3.235.73.95","192.168.0.107","TCP","66","443  >  50594 [ACK] Seq=1 Ack=518 Win=64768 Len=0 TSval=2174456152 TSecr=66575608"
"146","6.110337","13.32.145.75","192.168.0.107","TCP","66","443  >  50593 [ACK] Seq=1 Ack=518 Win=64512 Len=0 TSval=2566555262 TSecr=66575607"
"147","6.110341","3.235.73.95","192.168.0.107","TCP","78","[TCP Dup ACK 145#1] 443  >  50594 [ACK] Seq=1 Ack=518 Win=64768 Len=0 TSval=2174456158 TSecr=66575667 SLE=1 SRE=518"
"148","6.110963","216.58.212.131","192.168.0.107","QUIC","1392","Initial, SCID=61e05a1e12154ea2"
"149","6.128047","13.32.145.78","192.168.0.107","TCP","66","443  >  50595 [ACK] Seq=1 Ack=518 Win=64512 Len=0 TSval=4243332516 TSecr=66575640"
"150","6.128391","216.58.212.131","192.168.0.107","QUIC","1392","Initial, SCID=61e05a1e12154ea2"
"151","6.129809","192.168.0.107","216.58.212.131","QUIC","1392","Initial, DCID=61e05a1e12154ea2"
"152","6.139059","216.58.212.131","192.168.0.107","QUIC","287","Handshake, SCID=61e05a1e12154ea2"
"153","6.140665","192.168.0.107","216.58.212.131","QUIC","83","Handshake, DCID=61e05a1e12154ea2"
"154","6.149185","216.58.212.131","192.168.0.107","QUIC","103","Protected Payload (KP0)"
"155","6.149688","216.58.212.163","192.168.0.107","UDP","1392","443  >  59404 Len=1350"
"156","6.150494","192.168.0.107","216.58.212.163","UDP","75","59404  >  443 Len=33"
"157","6.152484","192.168.0.107","216.58.212.131","QUIC","115","Handshake, DCID=61e05a1e12154ea2"
"158","6.152621","192.168.0.107","216.58.212.131","QUIC","114","Protected Payload (KP0), DCID=61e05a1e12154ea2"
"159","6.154391","13.32.145.75","192.168.0.107","TCP","78","[TCP Dup ACK 146#1] 443  >  50593 [ACK] Seq=1 Ack=518 Win=64512 Len=0 TSval=2566555301 TSecr=66575697 SLE=1 SRE=518"
"160","6.154396","13.32.145.78","192.168.0.107","TCP","66","443  >  50592 [ACK] Seq=4870 Ack=582 Win=64512 Len=0 TSval=4243332536 TSecr=66575700"
"161","6.155088","13.32.145.75","192.168.0.107","TLSv1.3","1354","Server Hello, Change Cipher Spec, Application Data"
"162","6.173716","13.32.145.75","192.168.0.107","TCP","166","443  >  50593 [PSH, ACK] Seq=1289 Ack=518 Win=64512 Len=100 TSval=2566555336 TSecr=66575697 [TCP segment of a reassembled PDU]"
"163","6.173829","192.168.0.107","13.32.145.75","TCP","66","50593  >  443 [ACK] Seq=518 Ack=1389 Win=130944 Len=0 TSval=66575766 TSecr=2566555336"
"164","6.173965","13.32.145.75","192.168.0.107","TCP","1354","443  >  50593 [ACK] Seq=1389 Ack=518 Win=64512 Len=1288 TSval=2566555337 TSecr=66575697 [TCP segment of a reassembled PDU]"
"165","6.178140","192.168.0.107","216.58.212.131","QUIC","75","Protected Payload (KP0), DCID=61e05a1e12154ea2"
"166","6.183571","13.32.145.75","192.168.0.107","TCP","166","443  >  50593 [PSH, ACK] Seq=2677 Ack=518 Win=64512 Len=100 TSval=2566555337 TSecr=66575697 [TCP segment of a reassembled PDU]"
"167","6.183683","192.168.0.107","13.32.145.75","TCP","66","50593  >  443 [ACK] Seq=518 Ack=2777 Win=130944 Len=0 TSval=66575775 TSecr=2566555337"
"168","6.186207","13.32.145.75","192.168.0.107","TCP","1354","443  >  50593 [ACK] Seq=2777 Ack=518 Win=64512 Len=1288 TSval=2566555337 TSecr=66575697 [TCP segment of a reassembled PDU]"
"169","6.201692","13.32.145.75","192.168.0.107","TCP","166","443  >  50593 [PSH, ACK] Seq=4065 Ack=518 Win=64512 Len=100 TSval=2566555337 TSecr=66575697 [TCP segment of a reassembled PDU]"
"170","6.201698","13.32.145.75","192.168.0.107","TLSv1.3","771","Application Data, Application Data, Application Data"
"171","6.201821","192.168.0.107","13.32.145.75","TCP","66","50593  >  443 [ACK] Seq=518 Ack=4165 Win=130944 Len=0 TSval=66575791 TSecr=2566555337"
"172","6.201876","192.168.0.107","13.32.145.75","TCP","66","50593  >  443 [ACK] Seq=518 Ack=4870 Win=130240 Len=0 TSval=66575791 TSecr=2566555339"
"173","6.214807","192.168.0.107","13.32.145.75","TLSv1.3","130","Change Cipher Spec, Application Data"
"174","6.214980","13.32.145.78","192.168.0.107","TLSv1.3","128","Application Data"
"175","6.215098","192.168.0.107","13.32.145.78","TCP","66","50592  >  443 [ACK] Seq=582 Ack=4932 Win=131008 Len=0 TSval=66575803 TSecr=4243332593"
"176","6.219005","13.32.145.78","192.168.0.107","TLSv1.3","1354","Server Hello, Change Cipher Spec, Application Data"
"177","6.230626","13.32.145.78","192.168.0.107","TCP","1354","443  >  50595 [ACK] Seq=1289 Ack=518 Win=64512 Len=1288 TSval=4243332594 TSecr=66575640 [TCP segment of a reassembled PDU]"
"178","6.230727","192.168.0.107","13.32.145.78","TCP","66","50595  >  443 [ACK] Seq=518 Ack=2577 Win=129728 Len=0 TSval=66575818 TSecr=4243332594"
"179","6.244769","13.32.145.78","192.168.0.107","TCP","1354","443  >  50595 [ACK] Seq=2577 Ack=518 Win=64512 Len=1288 TSval=4243332594 TSecr=66575640 [TCP segment of a reassembled PDU]"
"180","6.257361","13.32.145.78","192.168.0.107","TCP","366","443  >  50595 [PSH, ACK] Seq=3865 Ack=518 Win=64512 Len=300 TSval=4243332594 TSecr=66575640 [TCP segment of a reassembled PDU]"
"181","6.257475","192.168.0.107","13.32.145.78","TCP","66","50595  >  443 [ACK] Seq=518 Ack=4165 Win=130752 Len=0 TSval=66575844 TSecr=4243332594"
"182","6.259717","13.32.145.78","192.168.0.107","TLSv1.3","771","Application Data, Application Data, Application Data"
"183","6.259814","192.168.0.107","13.32.145.78","TCP","66","50595  >  443 [ACK] Seq=518 Ack=4870 Win=130304 Len=0 TSval=66575846 TSecr=4243332597"
"184","6.271682","216.58.212.131","192.168.0.107","QUIC","654","Protected Payload (KP0)"
"185","6.272831","192.168.0.107","13.32.145.78","TLSv1.3","130","Change Cipher Spec, Application Data"
"186","6.273492","216.58.212.131","192.168.0.107","QUIC","67","Protected Payload (KP0)"
"187","6.273757","192.168.0.107","216.58.212.131","QUIC","75","Protected Payload (KP0), DCID=61e05a1e12154ea2"
"188","6.273936","13.32.145.75","192.168.0.107","TCP","66","443  >  50593 [ACK] Seq=4870 Ack=582 Win=64512 Len=0 TSval=2566555417 TSecr=66575803"
"189","6.274641","216.58.212.131","192.168.0.107","QUIC","67","Protected Payload (KP0)"
"190","6.285163","13.32.145.78","192.168.0.107","TCP","66","443  >  50595 [ACK] Seq=4870 Ack=582 Win=64512 Len=0 TSval=4243332704 TSecr=66575858"
"191","6.291351","13.32.145.75","192.168.0.107","TLSv1.3","128","Application Data"
"192","6.291460","192.168.0.107","13.32.145.75","TCP","66","50593  >  443 [ACK] Seq=582 Ack=4932 Win=131008 Len=0 TSval=66575875 TSecr=2566555475"
"193","6.310065","3.235.73.95","192.168.0.107","TLSv1.2","1414","Server Hello"
"194","6.311712","3.235.73.95","192.168.0.107","TCP","1414","443  >  50594 [ACK] Seq=1349 Ack=518 Win=64768 Len=1348 TSval=2174456383 TSecr=66575667 [TCP segment of a reassembled PDU]"
"195","6.311854","192.168.0.107","3.235.73.95","TCP","66","50594  >  443 [ACK] Seq=518 Ack=2697 Win=129664 Len=0 TSval=66575894 TSecr=2174456383"
"196","6.325819","3.235.73.95","192.168.0.107","TLSv1.2","1414","Certificate [TCP segment of a reassembled PDU]"
"197","6.326008","192.168.0.107","3.235.73.95","TCP","66","50594  >  443 [ACK] Seq=518 Ack=4045 Win=131072 Len=0 TSval=66575908 TSecr=2174456383"
"198","6.341960","3.235.73.95","192.168.0.107","TLSv1.2","812","Certificate Status, Server Key Exchange, Server Hello Done"
"199","6.342066","192.168.0.107","3.235.73.95","TCP","66","50594  >  443 [ACK] Seq=518 Ack=4791 Win=130304 Len=0 TSval=66575924 TSecr=2174456383"
"200","6.355101","192.168.0.107","3.235.73.95","TLSv1.2","192","Client Key Exchange, Change Cipher Spec, Encrypted Handshake Message"
"201","6.355223","192.168.0.107","3.235.73.95","TLSv1.2","165","Application Data"
"202","6.355587","192.168.0.107","3.235.73.95","TLSv1.2","950","Application Data"
"203","6.368697","13.32.145.78","192.168.0.107","TLSv1.3","128","Application Data"
"204","6.368760","192.168.0.107","13.32.145.78","TCP","66","50595  >  443 [ACK] Seq=582 Ack=4932 Win=131008 Len=0 TSval=66575950 TSecr=4243332776"
"205","6.374860","3.235.73.95","192.168.0.107","TCP","66","443  >  50594 [ACK] Seq=4791 Ack=644 Win=64768 Len=0 TSval=2174456449 TSecr=66575937"
"206","6.374864","3.235.73.95","192.168.0.107","TCP","66","443  >  50594 [ACK] Seq=4791 Ack=743 Win=64768 Len=0 TSval=2174456449 TSecr=66575937"
"207","6.375052","3.235.73.95","192.168.0.107","TCP","66","443  >  50594 [ACK] Seq=4791 Ack=1627 Win=64256 Len=0 TSval=2174456449 TSecr=66575937"
"208","6.512347","3.235.73.95","192.168.0.107","TLSv1.2","117","Change Cipher Spec, Encrypted Handshake Message"
"209","6.512457","192.168.0.107","3.235.73.95","TCP","66","50594  >  443 [ACK] Seq=1627 Ack=4842 Win=131008 Len=0 TSval=66576093 TSecr=2174456584"
"210","6.512781","3.235.73.95","192.168.0.107","TLSv1.2","144","Application Data"
"211","6.512901","192.168.0.107","3.235.73.95","TCP","66","50594  >  443 [ACK] Seq=1627 Ack=4920 Win=130944 Len=0 TSval=66576093 TSecr=2174456584"
"212","6.513240","192.168.0.107","3.235.73.95","TLSv1.2","104","Application Data"
"213","6.528397","3.235.73.95","192.168.0.107","TCP","66","443  >  50594 [ACK] Seq=4920 Ack=1665 Win=64256 Len=0 TSval=2174456603 TSecr=66576093"
"214","6.558410","3.235.73.95","192.168.0.107","TCP","1414","443  >  50594 [ACK] Seq=4920 Ack=1665 Win=64256 Len=1348 TSval=2174456626 TSecr=66576093 [TCP segment of a reassembled PDU]"
"215","6.558867","3.235.73.95","192.168.0.107","TCP","1414","443  >  50594 [ACK] Seq=6268 Ack=1665 Win=64256 Len=1348 TSval=2174456626 TSecr=66576093 [TCP segment of a reassembled PDU]"
"216","6.558954","192.168.0.107","3.235.73.95","TCP","66","50594  >  443 [ACK] Seq=1665 Ack=7616 Win=129664 Len=0 TSval=66576138 TSecr=2174456626"
"217","6.573472","3.235.73.95","192.168.0.107","TCP","1414","443  >  50594 [ACK] Seq=7616 Ack=1665 Win=64256 Len=1348 TSval=2174456626 TSecr=66576093 [TCP segment of a reassembled PDU]"
"218","6.573666","192.168.0.107","3.235.73.95","TCP","66","50594  >  443 [ACK] Seq=1665 Ack=8964 Win=131072 Len=0 TSval=66576152 TSecr=2174456626"
"219","6.579372","3.235.73.95","192.168.0.107","TLSv1.2","1414","Application Data [TCP segment of a reassembled PDU]"
"220","6.602754","3.235.73.95","192.168.0.107","TLSv1.2","578","Application Data, Application Data"
"221","6.602815","192.168.0.107","3.235.73.95","TCP","66","50594  >  443 [ACK] Seq=1665 Ack=10824 Win=130560 Len=0 TSval=66576180 TSecr=2174456626"
"222","6.647281","192.168.0.107","10.0.25.10","DNS","78","Standard query 0xe04b A static.ada.support"
"223","6.674361","10.0.25.10","192.168.0.107","DNS","142","Standard query response 0xe04b A static.ada.support A 13.32.145.53 A 13.32.145.40 A 13.32.145.21 A 13.32.145.36"
"224","6.675822","192.168.0.107","13.32.145.53","TCP","78","50596  >  443 [SYN, ECN, CWR] Seq=0 Win=65535 Len=0 MSS=1460 WS=64 TSval=66576252 TSecr=0 SACK_PERM=1"
"225","6.683264","192.168.0.107","10.0.25.10","DNS","89","Standard query 0x0076 A d24cgw3uvb9a9h.cloudfront.net"
"226","6.685733","13.32.145.53","192.168.0.107","TCP","74","443  >  50596 [SYN, ACK, ECN] Seq=0 Ack=1 Win=65236 Len=0 MSS=1360 SACK_PERM=1 TSval=660142187 TSecr=66576252 WS=128"
"227","6.685805","192.168.0.107","13.32.145.53","TCP","66","50596  >  443 [ACK] Seq=1 Ack=1 Win=132096 Len=0 TSval=66576262 TSecr=660142187"
"228","6.687539","192.168.0.107","13.32.145.53","TLSv1.3","583","Client Hello"
"229","6.702194","10.0.25.10","192.168.0.107","DNS","153","Standard query response 0x0076 A d24cgw3uvb9a9h.cloudfront.net A 99.86.88.152 A 99.86.88.154 A 99.86.88.186 A 99.86.88.96"
"230","6.702466","192.168.0.107","99.86.88.152","TCP","78","50597  >  443 [SYN, ECN, CWR] Seq=0 Win=65535 Len=0 MSS=1460 WS=64 TSval=66576277 TSecr=0 SACK_PERM=1"
"231","6.714025","99.86.88.152","192.168.0.107","TCP","74","443  >  50597 [SYN, ACK, ECN] Seq=0 Ack=1 Win=65236 Len=0 MSS=1360 SACK_PERM=1 TSval=1706721310 TSecr=66576277 WS=128"
"232","6.714097","192.168.0.107","99.86.88.152","TCP","66","50597  >  443 [ACK] Seq=1 Ack=1 Win=132096 Len=0 TSval=66576288 TSecr=1706721310"
"233","6.714429","192.168.0.107","99.86.88.152","TLSv1.3","583","Client Hello"
"234","6.734874","192.168.0.107","13.32.145.53","TCP","583","[TCP Retransmission] 50596  >  443 [PSH, ACK] Seq=1 Ack=1 Win=132096 Len=517 TSval=66576308 TSecr=660142187"
"235","6.752896","13.32.145.53","192.168.0.107","TCP","66","443  >  50596 [ACK] Seq=1 Ack=518 Win=64512 Len=0 TSval=660142272 TSecr=66576263"
"236","6.756482","13.32.145.53","192.168.0.107","TCP","78","[TCP Dup ACK 235#1] 443  >  50596 [ACK] Seq=1 Ack=518 Win=64512 Len=0 TSval=660142278 TSecr=66576308 SLE=1 SRE=518"
"237","6.765138","192.168.0.107","99.86.88.152","TCP","583","[TCP Retransmission] 50597  >  443 [PSH, ACK] Seq=1 Ack=1 Win=132096 Len=517 TSval=66576337 TSecr=1706721310"
"238","6.783882","99.86.88.152","192.168.0.107","TCP","66","443  >  50597 [ACK] Seq=1 Ack=518 Win=64512 Len=0 TSval=1706721421 TSecr=66576288"
"239","6.786182","99.86.88.152","192.168.0.107","TCP","78","[TCP Dup ACK 238#1] 443  >  50597 [ACK] Seq=1 Ack=518 Win=64512 Len=0 TSval=1706721432 TSecr=66576337 SLE=1 SRE=518"
"240","6.824733","13.32.145.53","192.168.0.107","TLSv1.3","1354","Server Hello, Change Cipher Spec, Application Data"
"241","6.825824","13.32.145.53","192.168.0.107","TCP","1354","443  >  50596 [ACK] Seq=1289 Ack=518 Win=64512 Len=1288 TSval=660142346 TSecr=66576308 [TCP segment of a reassembled PDU]"
"242","6.825887","192.168.0.107","13.32.145.53","TCP","66","50596  >  443 [ACK] Seq=518 Ack=2577 Win=129728 Len=0 TSval=66576396 TSecr=660142346"
"243","6.835877","13.32.145.53","192.168.0.107","TCP","1354","443  >  50596 [ACK] Seq=2577 Ack=518 Win=64512 Len=1288 TSval=660142346 TSecr=66576308 [TCP segment of a reassembled PDU]"
"244","6.845883","13.32.145.53","192.168.0.107","TCP","366","443  >  50596 [PSH, ACK] Seq=3865 Ack=518 Win=64512 Len=300 TSval=660142346 TSecr=66576308 [TCP segment of a reassembled PDU]"
"245","6.845965","192.168.0.107","13.32.145.53","TCP","66","50596  >  443 [ACK] Seq=518 Ack=4165 Win=130752 Len=0 TSval=66576415 TSecr=660142346"
"246","6.855358","13.32.145.53","192.168.0.107","TCP","1354","443  >  50596 [ACK] Seq=4165 Ack=518 Win=64512 Len=1288 TSval=660142348 TSecr=66576308 [TCP segment of a reassembled PDU]"
"247","6.869884","13.32.145.53","192.168.0.107","TLSv1.3","166","Application Data [TCP segment of a reassembled PDU]"
"248","6.869962","192.168.0.107","13.32.145.53","TCP","66","50596  >  443 [ACK] Seq=518 Ack=5553 Win=130944 Len=0 TSval=66576438 TSecr=660142348"
"249","6.870209","13.32.145.53","192.168.0.107","TLSv1.3","401","Application Data, Application Data"
"250","6.870264","192.168.0.107","13.32.145.53","TCP","66","50596  >  443 [ACK] Seq=518 Ack=5888 Win=130688 Len=0 TSval=66576438 TSecr=660142349"
"251","6.870538","99.86.88.152","192.168.0.107","TLSv1.3","1354","Server Hello, Change Cipher Spec, Application Data"
"252","6.882248","192.168.0.107","13.32.145.53","TLSv1.3","130","Change Cipher Spec, Application Data"
"253","6.882553","192.168.0.107","13.32.145.53","TLSv1.3","158","Application Data"
"254","6.882776","192.168.0.107","13.32.145.53","TLSv1.3","405","Application Data"
"255","6.891378","99.86.88.152","192.168.0.107","TCP","1354","443  >  50597 [ACK] Seq=1289 Ack=518 Win=64512 Len=1288 TSval=1706721503 TSecr=66576337 [TCP segment of a reassembled PDU]"
"256","6.891450","192.168.0.107","99.86.88.152","TCP","66","50597  >  443 [ACK] Seq=518 Ack=2577 Win=129728 Len=0 TSval=66576459 TSecr=1706721503"
"257","6.907219","99.86.88.152","192.168.0.107","TCP","1354","443  >  50597 [ACK] Seq=2577 Ack=518 Win=64512 Len=1288 TSval=1706721503 TSecr=66576337 [TCP segment of a reassembled PDU]"
"258","6.917594","99.86.88.152","192.168.0.107","TCP","366","443  >  50597 [PSH, ACK] Seq=3865 Ack=518 Win=64512 Len=300 TSval=1706721503 TSecr=66576337 [TCP segment of a reassembled PDU]"
"259","6.917656","192.168.0.107","99.86.88.152","TCP","66","50597  >  443 [ACK] Seq=518 Ack=4165 Win=130752 Len=0 TSval=66576484 TSecr=1706721503"
"260","6.917969","99.86.88.152","192.168.0.107","TLSv1.3","944","Application Data, Application Data, Application Data"
"261","6.918013","192.168.0.107","99.86.88.152","TCP","66","50597  >  443 [ACK] Seq=518 Ack=5043 Win=130176 Len=0 TSval=66576484 TSecr=1706721505"
"262","6.926259","13.32.145.53","192.168.0.107","TCP","66","443  >  50596 [ACK] Seq=5888 Ack=582 Win=64512 Len=0 TSval=660142428 TSecr=66576450"
"263","6.926263","13.32.145.53","192.168.0.107","TCP","66","443  >  50596 [ACK] Seq=5888 Ack=674 Win=64512 Len=0 TSval=660142428 TSecr=66576450"
"264","6.926857","13.32.145.53","192.168.0.107","TCP","66","443  >  50596 [ACK] Seq=5888 Ack=1013 Win=64256 Len=0 TSval=660142428 TSecr=66576450"
"265","6.927986","192.168.0.107","99.86.88.152","TLSv1.3","130","Change Cipher Spec, Application Data"
"266","6.928520","192.168.0.107","99.86.88.152","TLSv1.3","158","Application Data"
"267","6.929022","192.168.0.107","99.86.88.152","TLSv1.3","446","Application Data"
"268","6.948510","99.86.88.152","192.168.0.107","TCP","66","443  >  50597 [ACK] Seq=5043 Ack=582 Win=64512 Len=0 TSval=1706721591 TSecr=66576493"
"269","6.948514","99.86.88.152","192.168.0.107","TCP","66","443  >  50597 [ACK] Seq=5043 Ack=674 Win=64512 Len=0 TSval=1706721591 TSecr=66576493"
"270","6.948851","99.86.88.152","192.168.0.107","TCP","66","443  >  50597 [ACK] Seq=5043 Ack=1054 Win=64256 Len=0 TSval=1706721591 TSecr=66576494"
"271","6.968833","13.32.145.53","192.168.0.107","TLSv1.3","137","Application Data"
"272","6.968901","192.168.0.107","13.32.145.53","TCP","66","50596  >  443 [ACK] Seq=1013 Ack=5959 Win=130944 Len=0 TSval=66576533 TSecr=660142486"
"273","6.969032","192.168.0.107","13.32.145.53","TLSv1.3","97","Application Data"
"274","6.969751","13.32.145.53","192.168.0.107","TLSv1.3","500","Application Data"
"275","6.969805","192.168.0.107","13.32.145.53","TCP","66","50596  >  443 [ACK] Seq=1044 Ack=6393 Win=130624 Len=0 TSval=66576533 TSecr=660142488"
"276","6.970195","192.168.0.107","13.32.145.53","TLSv1.3","101","Application Data"
"277","6.991271","13.32.145.53","192.168.0.107","TCP","66","443  >  50596 [ACK] Seq=6393 Ack=1044 Win=64256 Len=0 TSval=660142517 TSecr=66576533"
"278","6.991275","13.32.145.53","192.168.0.107","TCP","66","443  >  50596 [ACK] Seq=6393 Ack=1079 Win=64256 Len=0 TSval=660142517 TSecr=66576534"
"279","7.003299","99.86.88.152","192.168.0.107","TLSv1.3","137","Application Data"
"280","7.003383","192.168.0.107","99.86.88.152","TCP","66","50597  >  443 [ACK] Seq=1054 Ack=5114 Win=130944 Len=0 TSval=66576566 TSecr=1706721649"
"281","7.003482","99.86.88.152","192.168.0.107","TLSv1.3","412","Application Data"
"282","7.003536","192.168.0.107","99.86.88.152","TCP","66","50597  >  443 [ACK] Seq=1054 Ack=5460 Win=130688 Len=0 TSval=66576566 TSecr=1706721651"
"283","7.003571","192.168.0.107","99.86.88.152","TLSv1.3","97","Application Data"
"284","7.003893","192.168.0.107","99.86.88.152","TLSv1.3","101","Application Data"
"285","7.018578","99.86.88.152","192.168.0.107","TCP","66","443  >  50597 [ACK] Seq=5460 Ack=1085 Win=64256 Len=0 TSval=1706721669 TSecr=66576566"
"286","7.018581","99.86.88.152","192.168.0.107","TCP","66","443  >  50597 [ACK] Seq=5460 Ack=1120 Win=64256 Len=0 TSval=1706721669 TSecr=66576566"
"287","7.100470","192.168.0.107","10.0.25.10","DNS","79","Standard query 0xc8e7 A rollout.ada.support"
"288","7.112087","10.0.25.10","192.168.0.107","DNS","143","Standard query response 0xc8e7 A rollout.ada.support A 13.249.11.84 A 13.249.11.129 A 13.249.11.7 A 13.249.11.104"
"289","7.112455","192.168.0.107","13.249.11.84","TCP","78","50598  >  443 [SYN, ECN, CWR] Seq=0 Win=65535 Len=0 MSS=1460 WS=64 TSval=66576673 TSecr=0 SACK_PERM=1"
"290","7.126039","13.249.11.84","192.168.0.107","TCP","74","443  >  50598 [SYN, ACK, ECN] Seq=0 Ack=1 Win=65236 Len=0 MSS=1360 SACK_PERM=1 TSval=3879250534 TSecr=66576673 WS=128"
"291","7.126117","192.168.0.107","13.249.11.84","TCP","66","50598  >  443 [ACK] Seq=1 Ack=1 Win=132096 Len=0 TSval=66576686 TSecr=3879250534"
"292","7.126303","192.168.0.107","13.249.11.84","TLSv1.3","583","Client Hello"
"293","7.174488","192.168.0.107","3.235.73.95","TLSv1.2","311","Application Data"
"294","7.174595","192.168.0.107","3.235.73.95","TLSv1.2","399","Application Data"
